bookingBusinessId,reviewId,reviewBody,score,isImp,replyBody,resourceUrlList/0,completedDate,id,bookingItemName,bookingBusinessName,optionNameList,body/0/isHighlight,body/0/text,resourceUrlList/1,replyRegDate
158179,6388491,양쪽 매복수평사랑니라 뽑는데 힘들었네요 처음엔 뭣도모르고 동네치과가서 뽑다가 턱도 너덜너덜해지고 아프고 부어서 진짜 고생했어요. 반대쪽을 어찌할까 두려움으로 고민하다 사랑니 발치로 유명한 라이크치과를 찾았어요.시설도 좋구 안내해주시는분들도 너무 친절합니다.의사쌤도 덤덤하게 잘 뽑으시는거같아요. 마취크림덕분에 주사도 버틸만했어요. 사후관리도 너무 잘되있고 지인이 사랑니 뽑는다 하면 무조건 여기 추천할거에요. 첫 경험이 너무 무서워서 두번째발치때 덜덜떨었는데 하나도 안아프고 너무 금방끝났어요.,5,1,,https://naverbooking-phinf.pstatic.net/20190816_223/1565965264554eYwch_JPEG/image.jpg,2019.08.13,ges8****,라이크치과,라이크치과의원,,false,양쪽 매복수평사랑니라 뽑는데 힘들었네요 처음엔 뭣도모르고 동네치과가서 뽑다가 턱도 너덜너덜해지고 아프고 부어서 진짜 고생했어요. 반대쪽을 어찌할까 두려움으로 고민하다 사랑니 발치로 유명한 라이크치과를 찾았어요.시설도 좋구 안내해주시는분들도 너무 친절합니다.의사쌤도 덤덤하게 잘 뽑으시는거같아요. 마취크림덕분에 주사도 버틸만했어요. 사후관리도 너무 잘되있고 지인이 사랑니 뽑는다 하면 무조건 여기 추천할거에요. 첫 경험이 너무 무서워서 두번째발치때 덜덜떨었는데 하나도 안아프고 너무 금방끝났어요.,,
158179,6335679,사랑니 위아래 발치했는데 아프지않고 엄청 빠르게 해주셨어요 친절합니다~~,5,1,,,2019.08.13,tpgn****,라이크치과,라이크치과의원,,false,사랑니 위아래 발치했는데 아프지않고 엄청 빠르게 해주셨어요 친절합니다~~,,
158179,6322932,"왼쪽 사랑니 두 개를 한 번에 발치했는데 하루 지난 현재 붓기도 거의 없어서 너무 만족스러웠어요! 저는 하나만 뽑은 줄 알았는데 어느새 두 개 다 뽑으셨다고 하셔서 놀랐어요.

통증도 지혈솜 빼고 3-40분 정도만 있었고 일상생활에 불편하지 않을 정도로 안 아파서 너무 만족합니다...! 특히 마취 주사 전에 마취 크림도 발라주셔서 너무 좋았어요.(아픈 것 못 참는 분들 꼭 라이크 가세요) 인형도 쥐어주셔서 너무 좋았습니다!",5,1,,https://naverbooking-phinf.pstatic.net/20190813_35/1565662651257u4bKF_JPEG/image.jpg,2019.08.12,qhal****,라이크치과,라이크치과의원,,false,"왼쪽 사랑니 두 개를 한 번에 발치했는데 하루 지난 현재 붓기도 거의 없어서 너무 만족스러웠어요! 저는 하나만 뽑은 줄 알았는데 어느새 두 개 다 뽑으셨다고 하셔서 놀랐어요.

통증도 지혈솜 빼고 3-40분 정도만 있었고 일상생활에 불편하지 않을 정도로 안 아파서 너무 만족합니다...! 특히 마취 주사 전에 마취 크림도 발라주셔서 너무 좋았어요.(아픈 것 못 참는 분들 꼭 라이크 가세요) 인형도 쥐어주셔서 너무 좋았습니다!",,
158179,6320005,너무 친절하세요~,5,1,,,2019.08.10,stel****,라이크치과,라이크치과의원,,false,너무 친절하세요~,,
158179,6317714,"저는 원체 엄살이 심한 사람이라 사랑니는 뽑을 생각도 하지 않았습니다.
매복사랑니가 특이하게 나서 큰병원가서 뽑으라는 말만 들었거든요.
하지만 다른 쪽 사랑니가 나면서 치열이 틀어지길래 할 수 없이 뽑긴 뽑아야겠고 아프긴 싫고 검색을 열심히 했습니다.
정말 하나도 안 아프다는 말만 믿고 갔는데 매복사랑니도 뽑아주신다는 말에 두개를 뽑았습니다.
마취주사를 제일 무서워하는데 마취크림을 바른 다음에 맞아서 별로 안 아팠고 사랑니는 정말 하나도 하나~도 안 아팠어요.
매복 사랑니는 오래 걸린다 하셔서 정말 오래 걸릴 줄 알았는데 5분도 안 걸려서 뽑아주셨고 밖으로 난 사랑니는 오바 안 하고 손이 닿자마자 뽑으셨어요.
마취주사 맞고 기다리면서 떤 게 무색할 정도로 안 아프고 붓지도 않았네요.쫄보가 감사해서 남깁니다.",5,1,,,2019.08.10,llii****,라이크치과,라이크치과의원,,false,"저는 원체 엄살이 심한 사람이라 사랑니는 뽑을 생각도 하지 않았습니다.
매복사랑니가 특이하게 나서 큰병원가서 뽑으라는 말만 들었거든요.
하지만 다른 쪽 사랑니가 나면서 치열이 틀어지길래 할 수 없이 뽑긴 뽑아야겠고 아프긴 싫고 검색을 열심히 했습니다.
정말 하나도 안 아프다는 말만 믿고 갔는데 매복사랑니도 뽑아주신다는 말에 두개를 뽑았습니다.
마취주사를 제일 무서워하는데 마취크림을 바른 다음에 맞아서 별로 안 아팠고 사랑니는 정말 하나도 하나~도 안 아팠어요.
매복 사랑니는 오래 걸린다 하셔서 정말 오래 걸릴 줄 알았는데 5분도 안 걸려서 뽑아주셨고 밖으로 난 사랑니는 오바 안 하고 손이 닿자마자 뽑으셨어요.
마취주사 맞고 기다리면서 떤 게 무색할 정도로 안 아프고 붓지도 않았네요.쫄보가 감사해서 남깁니다.",,
158179,6308373,"하악쪽 매복 사랑니가 신경과 근접해서 대학병원가서 뽑으라고 다 퇴짜 맞았었는데,
라이크치과에서는 ct촬영까지 하고 난뒤 바로 당일 발치까지 했습니다~
두개의 매복 사랑니를 5분컷으로 뽑아주셨어요~!
마취 풀릴때만 아팠고, 그 뒤로는 전혀 아픔 없었습니다~~
붓기도 하루만에 다 빠졌어요!!! 

다른 사람들이 매복 사랑니 뽑으러 간다고 하면 100번 1000번 추천할 치과입니다~!",5,1,,,2019.08.09,jyg0****,라이크치과,라이크치과의원,,false,"하악쪽 매복 사랑니가 신경과 근접해서 대학병원가서 뽑으라고 다 퇴짜 맞았었는데,
라이크치과에서는 ct촬영까지 하고 난뒤 바로 당일 발치까지 했습니다~
두개의 매복 사랑니를 5분컷으로 뽑아주셨어요~!
마취 풀릴때만 아팠고, 그 뒤로는 전혀 아픔 없었습니다~~
붓기도 하루만에 다 빠졌어요!!! 

다른 사람들이 매복 사랑니 뽑으러 간다고 하면 100번 1000번 추천할 치과입니다~!",,
158179,6261002,하나도 안아파요.,5,1,,,2019.08.09,hahu****,라이크치과,라이크치과의원,,false,하나도 안아파요.,,
158179,6260728,사랑니발치 안아프게 잘 뽑아주세여~~ 무서울까봐 인형까지 안고있으라고 하는 센스 !!,5,1,,https://naverbooking-phinf.pstatic.net/20190810_254/15653955371262NRzs_JPEG/image.jpg,2019.08.09,gytn****,라이크치과,라이크치과의원,,false,사랑니발치 안아프게 잘 뽑아주세여~~ 무서울까봐 인형까지 안고있으라고 하는 센스 !!,,
158179,6228324,사랑니 잘 뽑아주셔요,4,1,,,2019.08.06,ljke****,라이크치과,라이크치과의원,,false,사랑니 잘 뽑아주셔요,,
158179,6210115,"직원분들, 의사선생님 모두 친절하십니다!
사랑니도 아프지않게 금새 뽑아주셨어요! 사후 관리도 잘 해주십니다 ㅎㅎ",5,1,,,2019.08.05,love****,라이크치과,라이크치과의원,,false,"직원분들, 의사선생님 모두 친절하십니다!
사랑니도 아프지않게 금새 뽑아주셨어요! 사후 관리도 잘 해주십니다 ㅎㅎ",,
158179,6204346,"사랑니 발치때문에 방문했습니다.
누워나지는 않았지만 매복이였고 신경과 가깝다고 하여 어디를 가야하나 고민하다가 신촌에서 라이크치과가 좋다고 하여 방문했습니다!
평소 치과진료를 무서워해서 걱정이 많았는데 마취주사 맞기전에 마취크림을 발라주셔서 주사도 그냥 따끔한 정도였고 이 뽑을 때는 아프지도 않고 너무 금방 끝나서 뽑은 줄도 몰랐어요!ㅋㅋㅋ
주의사항도 꼼꼼하게 말씀해주시고 거즈 뺄 시간 되니 전화도 주시고 너무 친절하고 좋았습니다ㅎㅎ
저는 마취가 풀리고 나서도 크게 아프지않았고 전혀 붓지도 않았답니다.
사랑니 발치로 어디를 가야하나 고민하시는 분들은 라이크치과로 가세요!!",5,1,,,2019.08.05,5315****,라이크치과,라이크치과의원,,false,"사랑니 발치때문에 방문했습니다.
누워나지는 않았지만 매복이였고 신경과 가깝다고 하여 어디를 가야하나 고민하다가 신촌에서 라이크치과가 좋다고 하여 방문했습니다!
평소 치과진료를 무서워해서 걱정이 많았는데 마취주사 맞기전에 마취크림을 발라주셔서 주사도 그냥 따끔한 정도였고 이 뽑을 때는 아프지도 않고 너무 금방 끝나서 뽑은 줄도 몰랐어요!ㅋㅋㅋ
주의사항도 꼼꼼하게 말씀해주시고 거즈 뺄 시간 되니 전화도 주시고 너무 친절하고 좋았습니다ㅎㅎ
저는 마취가 풀리고 나서도 크게 아프지않았고 전혀 붓지도 않았답니다.
사랑니 발치로 어디를 가야하나 고민하시는 분들은 라이크치과로 가세요!!",,
158179,6132985,"일단 대기시간 없이 바로바로 진료 봐주시고 제가 뽑아본 사랑니중 제일 안아프게 뽑혔어요!!
뽑을 때 뿐만 아니라 마취풀리고나서도 안아팠던 사랑니는 처음입니다..!????",5,1,,,2019.08.02,rhth****,라이크치과,라이크치과의원,,false,"일단 대기시간 없이 바로바로 진료 봐주시고 제가 뽑아본 사랑니중 제일 안아프게 뽑혔어요!!
뽑을 때 뿐만 아니라 마취풀리고나서도 안아팠던 사랑니는 처음입니다..!????",,
158179,6105536,친절하시구 좋아요,5,1,,,2019.08.01,l_o3****,라이크치과,라이크치과의원,,false,친절하시구 좋아요,,
158179,6076108,"너무 친절하시구 
뽑는거 절대 안아프구요 통증도 생각보다 없었어요! 약간 욱씬거리는정도?
마취가 너무 안풀려서 그게 더 겁났네용ㅋ큐ㅠ 
아무튼 잘치료해 주셔서 감사합니다!!",5,1,,,2019.07.30,msy9****,라이크치과,라이크치과의원,,false,"너무 친절하시구 
뽑는거 절대 안아프구요 통증도 생각보다 없었어요! 약간 욱씬거리는정도?
마취가 너무 안풀려서 그게 더 겁났네용ㅋ큐ㅠ 
아무튼 잘치료해 주셔서 감사합니다!!",,
158179,6251910,마취도 짱짱하구 시술 후에도 신경써주셔서 좋아요!,5,1,,,2019.07.29,gmld****,라이크치과,라이크치과의원,,false,마취도 짱짱하구 시술 후에도 신경써주셔서 좋아요!,,
158179,6061032,"양쪽 아래 매복사랑니를 모두 라이크에서 발치했어요:)
블로그에 자체후기도 올릴만큼 너무나 섬세하게 관리해주시고, 남들은 멍들고 붓기도 생긴다는데 
저는 이를 쪼개 뽑았는데도 붓기가 거의 없을만큼 잘 뽑아주셔서 겁내지 않고 두번째 방문할 수 있었습니다.
이번에도 블로그에 후기 올릴게요! 감사해요~",5,1,,,2019.07.29,jeje****,라이크치과,라이크치과의원,,false,"양쪽 아래 매복사랑니를 모두 라이크에서 발치했어요:)
블로그에 자체후기도 올릴만큼 너무나 섬세하게 관리해주시고, 남들은 멍들고 붓기도 생긴다는데 
저는 이를 쪼개 뽑았는데도 붓기가 거의 없을만큼 잘 뽑아주셔서 겁내지 않고 두번째 방문할 수 있었습니다.
이번에도 블로그에 후기 올릴게요! 감사해요~",,
158179,6088185,친절하시고 안아프게 매복사랑니 발치 잘했어요~,5,1,,,2019.07.29,com2****,라이크치과,라이크치과의원,,false,친절하시고 안아프게 매복사랑니 발치 잘했어요~,,
158179,6020955,"비용적인 측면도 만족했고, 매복이었는데도 정말 빨리 끝났습니다. 발치 후에 전화로 확인해주시는 것도 좋았습니다. 진료 봐주시는 간호사 선생님이 불친절하셔서 별 하나 뺐어요.",4,1,,,2019.07.27,b_ky****,라이크치과,라이크치과의원,,false,"비용적인 측면도 만족했고, 매복이었는데도 정말 빨리 끝났습니다. 발치 후에 전화로 확인해주시는 것도 좋았습니다. 진료 봐주시는 간호사 선생님이 불친절하셔서 별 하나 뺐어요.",,
158179,6179187,매복사랑니였는데 10분도안돼서 발치했어요,5,1,,,2019.07.26,lren****,라이크치과,라이크치과의원,,false,매복사랑니였는데 10분도안돼서 발치했어요,,
158179,5989625,이동시간만 3시간이 꼬박 걸렸지만 전혀 후회가 없네요. 매복사랑니라 굉장히 걱정을 많이 했는데 아프지않게 잘 뽑아주셨습니다.,5,1,,,2019.07.25,luna****,라이크치과,라이크치과의원,,false,이동시간만 3시간이 꼬박 걸렸지만 전혀 후회가 없네요. 매복사랑니라 굉장히 걱정을 많이 했는데 아프지않게 잘 뽑아주셨습니다.,,
158179,6030752,"처음 이용 이지만 챈절 했습니다. 우선 체계적인 서비스와 단계 과정이 좋았고 내부 시설및 실제 사용되는 의료 장비등 깔끔해서 신뢰 했습니다. 접수부터 x레이 검사및 구강상태및 체크 과정 매끄러웠으며, 예약 서비스 통해 오랜 기다림 없었습니다. 돌아 오는 야간 진료 통해 발치 예정인데 큰 걱정 부담 없을 것 같습니다. 잘 모르시는 분들 추천 드려요!",5,1,,,2019.07.23,maru****,라이크치과,라이크치과의원,,false,"처음 이용 이지만 챈절 했습니다. 우선 체계적인 서비스와 단계 과정이 좋았고 내부 시설및 실제 사용되는 의료 장비등 깔끔해서 신뢰 했습니다. 접수부터 x레이 검사및 구강상태및 체크 과정 매끄러웠으며, 예약 서비스 통해 오랜 기다림 없었습니다. 돌아 오는 야간 진료 통해 발치 예정인데 큰 걱정 부담 없을 것 같습니다. 잘 모르시는 분들 추천 드려요!",,
158179,5977723,"선생님들 다 친절하세요~~!! 주의사항도 꼼꼼하게 설명해주시구요. 사소한 거지만 신경써주시는 게 느껴졌어요 
사랑니 뺏는데.. 무서워서 엄청 떨었지만ㅠㅠㅠ 별탈 없이 뽑았습니다..! 
인형이랑 담요도 준비되어 있는데, 무서워하는 거 보시고 인형을 주시던데.. 인형이 있어서 좋았어요ㅋㅋㅋ 인형 꼭 안고 진료 받았습니다.

위에 매복사랑니와 아래 삐뚤게 난 사랑니 아래 뽑았고.. 오른쪽에 매복사랑니 위아래도 뽑을 예정이에요!",5,1,,,2019.07.23,saeh****,라이크치과,라이크치과의원,,false,"선생님들 다 친절하세요~~!! 주의사항도 꼼꼼하게 설명해주시구요. 사소한 거지만 신경써주시는 게 느껴졌어요 
사랑니 뺏는데.. 무서워서 엄청 떨었지만ㅠㅠㅠ 별탈 없이 뽑았습니다..! 
인형이랑 담요도 준비되어 있는데, 무서워하는 거 보시고 인형을 주시던데.. 인형이 있어서 좋았어요ㅋㅋㅋ 인형 꼭 안고 진료 받았습니다.

위에 매복사랑니와 아래 삐뚤게 난 사랑니 아래 뽑았고.. 오른쪽에 매복사랑니 위아래도 뽑을 예정이에요!",,
158179,5970712,"검색해서 갔는데 마취주사 맞기전 마취크림발라서 주사도별로안아팟고 뽑는것도 안아팠는데
마취풀리니까 통증이 ㅋㅋ 
아주 잘뽑아주셔서 감사합니당",5,1,,,2019.07.23,whtn****,라이크치과,라이크치과의원,,false,"검색해서 갔는데 마취주사 맞기전 마취크림발라서 주사도별로안아팟고 뽑는것도 안아팠는데
마취풀리니까 통증이 ㅋㅋ 
아주 잘뽑아주셔서 감사합니당",,
158179,5962891,사랑니발치 아프지도않고 금방뽑았고 계신 선생님들이 다들 친절해서 좋았어용,5,1,,,2019.07.22,seul****,라이크치과,라이크치과의원,,false,사랑니발치 아프지도않고 금방뽑았고 계신 선생님들이 다들 친절해서 좋았어용,,
158179,5951791,치과를 너무 오랫만에 가는거고 충치치료에 대한 안좋은 기억때문에 너무 긴장하면서 갔는데 마취주사 맞기전에 마취크림도 발라주셔서 주사도 안아프고 치료장비(?)가 들어갈때마다 얘기해주셔서 맘편히 치료받을수있었습니다,5,1,,,2019.07.22,kimm****,라이크치과,라이크치과의원,,false,치과를 너무 오랫만에 가는거고 충치치료에 대한 안좋은 기억때문에 너무 긴장하면서 갔는데 마취주사 맞기전에 마취크림도 발라주셔서 주사도 안아프고 치료장비(?)가 들어갈때마다 얘기해주셔서 맘편히 치료받을수있었습니다,,
158179,5954475,"토요일에 발치하고 어제 소독까지 하고왔습니다.
줄곧 통증때문에 많이 걱정했었는데 라이크치과 덕분에 고민 해결했어요~
마취 과정, 발치, 마취풀린 후 통증 등 모든 것이 걱정됐는데 마취도 살짝 따끔한 수준이고 발치도 되게 순식간에 끝나요!
정말 안아프게 뽑아주셔서 너무 감사해요!! 발치도 발치지만 여기 선생님들이 너무 친절하세요~ 덕분에 긴장이 조금 풀린 것 같아요 ㅎㅎ
저도 남은 사랑니 뽑으러 재방문 할거구요, 친구들에게 직접 강추할만큼 믿고 가는 곳입니다~~",5,1,,,2019.07.20,bsjh****,라이크치과,라이크치과의원,,false,"토요일에 발치하고 어제 소독까지 하고왔습니다.
줄곧 통증때문에 많이 걱정했었는데 라이크치과 덕분에 고민 해결했어요~
마취 과정, 발치, 마취풀린 후 통증 등 모든 것이 걱정됐는데 마취도 살짝 따끔한 수준이고 발치도 되게 순식간에 끝나요!
정말 안아프게 뽑아주셔서 너무 감사해요!! 발치도 발치지만 여기 선생님들이 너무 친절하세요~ 덕분에 긴장이 조금 풀린 것 같아요 ㅎㅎ
저도 남은 사랑니 뽑으러 재방문 할거구요, 친구들에게 직접 강추할만큼 믿고 가는 곳입니다~~",,
158179,5962552,"지금까지 제가 가본 모든 병원을 통틀어 이렇게 친절한 곳은 없었습니다. 예약 전 전화문의도, 예약 후 하루전 및 당일 문자메시지도, 치료 후 주의사항 안내 문자메시지까지! 치료 과정은 말할 필요도 없이 편안하게 해주셨습니다. 라이크치과를 알려준 지인의 지인에게 감사의 말씀을 ㅠㅠ",5,1,,,2019.07.20,chae****,라이크치과,라이크치과의원,,false,"지금까지 제가 가본 모든 병원을 통틀어 이렇게 친절한 곳은 없었습니다. 예약 전 전화문의도, 예약 후 하루전 및 당일 문자메시지도, 치료 후 주의사항 안내 문자메시지까지! 치료 과정은 말할 필요도 없이 편안하게 해주셨습니다. 라이크치과를 알려준 지인의 지인에게 감사의 말씀을 ㅠㅠ",,
158179,5936325,사랑니 뽑으려고 대학병원 가려다 예약이 너무 오래걸려서 다른 병원 찾다보니 여기서 사랑니 잘 뽑아준다고 해서 갔어요. 직원분들 모두 친절하시고 설명도 잘 해주셔서 발치 후 관리에 어려움도 없었어요. 그리고 무슨 사랑니를 1분 만에 뽑으신 듯.. 사랑니 뽑는건 처음이라 좀 무서웠는데 마취하고 스케일링하면서 대기타는 시간 30분정도 걸렸고 정작 이 뽑는건 순식간이어서 얼떨떨했어요ㅋㅋㅋㅋㅋㅋ 리뷰 잘 안남기는데 탈 없이 잘 뽑아주셔서 남겨요. 다른 쪽 사랑니 하나 더 뽑으러 가야하네요..,5,1,,,2019.07.19,vani****,라이크치과,라이크치과의원,,false,사랑니 뽑으려고 대학병원 가려다 예약이 너무 오래걸려서 다른 병원 찾다보니 여기서 사랑니 잘 뽑아준다고 해서 갔어요. 직원분들 모두 친절하시고 설명도 잘 해주셔서 발치 후 관리에 어려움도 없었어요. 그리고 무슨 사랑니를 1분 만에 뽑으신 듯.. 사랑니 뽑는건 처음이라 좀 무서웠는데 마취하고 스케일링하면서 대기타는 시간 30분정도 걸렸고 정작 이 뽑는건 순식간이어서 얼떨떨했어요ㅋㅋㅋㅋㅋㅋ 리뷰 잘 안남기는데 탈 없이 잘 뽑아주셔서 남겨요. 다른 쪽 사랑니 하나 더 뽑으러 가야하네요..,,
158179,5881804,간호사선생님들 넘 친절해요 사랑니도 금방뽑고 지혈될때까지 전화해주시고 추천합니당,4,1,,,2019.07.17,park****,라이크치과,라이크치과의원,,false,간호사선생님들 넘 친절해요 사랑니도 금방뽑고 지혈될때까지 전화해주시고 추천합니당,,
158179,5869092,"선생님들도 다 친절하시고 마취주사, 이빨 빼는 것 까지 아프지 않고 신속하게 처리되어서 너무 좋았어요! 다음 사랑니 뺄 때도 라이크로 갈게요?",5,1,,,2019.07.16,ssss****,라이크치과,라이크치과의원,,false,"선생님들도 다 친절하시고 마취주사, 이빨 빼는 것 까지 아프지 않고 신속하게 처리되어서 너무 좋았어요! 다음 사랑니 뺄 때도 라이크로 갈게요?",,
158179,5917210,진료도 잘해주시고 사랑니도 안아프게 뽑았어요,5,1,,,2019.07.16,lde9****,라이크치과,라이크치과의원,,false,진료도 잘해주시고 사랑니도 안아프게 뽑았어요,,
158179,5856235,금방근방 끝나서 좋았어요,5,1,,,2019.07.15,hong****,라이크치과,라이크치과의원,,false,금방근방 끝나서 좋았어요,,
158179,5810911,병원 아늑하고 직원분들도 너무 친절해요~,5,1,,,2019.07.12,afaq****,라이크치과,라이크치과의원,,false,병원 아늑하고 직원분들도 너무 친절해요~,,
158179,5885959,스케일링 했는데 이도 안시리고 좋았어요,5,1,,,2019.07.11,kell****,라이크치과,라이크치과의원,,false,스케일링 했는데 이도 안시리고 좋았어요,,
158179,5785711,되게 아늑하고 편안했습니다 맨족맨족,5,1,,,2019.07.10,brow****,라이크치과,라이크치과의원,,false,되게 아늑하고 편안했습니다 맨족맨족,,
158179,5763896,예약하면 엄청 빠르고 사랑니 1분만에 빼줍니다,5,1,,,2019.07.08,fbwl****,라이크치과,라이크치과의원,,false,예약하면 엄청 빠르고 사랑니 1분만에 빼줍니다,,
158179,5739484,모든 분들이 정말 친절하셨어요 매복 사랑니었는데 통증 없이 정말 빨리 빼주셨습니다 뺀지 하루 됐는데 마취 풀려도 별로 아프지도 않아서 너무 다행이에요 밥도 아주 잘 먹고 있어요,5,1,,,2019.07.06,jaye****,라이크치과,라이크치과의원,,false,모든 분들이 정말 친절하셨어요 매복 사랑니었는데 통증 없이 정말 빨리 빼주셨습니다 뺀지 하루 됐는데 마취 풀려도 별로 아프지도 않아서 너무 다행이에요 밥도 아주 잘 먹고 있어요,,
158179,5781466,왼쪽 위아래 사랑니 발치했습니다! 솔직히 사랑니 빼는거 괜찮을까 걱정 많았구 제가 미주신경성 실신이 있어서 마취하거나 주사맞으면 꼭 쓰러졌거든요.. 마취주사도 저는 쫌 아팠구 아래 사랑니 뽑을때 턱도 시리고 해서 괴로웠는데 실신을 안 했어요..!!!! 계속 제 상태 확인해주시면서 진행해주셔서 그런가봐요 ㅎㅎ 이도 마취 풀리고 잠깐 한 10분정도 아프고 괜찮아져서 치킨도 먹고 그랫어요...ㅋㅋㅋㅋㅋㅋ 간호사선생님들 치위생사 선생님들 의사선생님 다 너무 친절하셔서 제가 엄청 징징댔는데 다 받아주시규... 걱정 많이 해주시구ㅜㅜ 감사해여ㅠㅠㅠㅠㅠㅠ 아직 오른쪽이 남았다는 사실이 너무 절망적이지만 오른쪽 위아래도 꼭 라이크치과에서 뺄거에요ㅠ,5,1,,,2019.07.05,tmda****,라이크치과,라이크치과의원,,false,왼쪽 위아래 사랑니 발치했습니다! 솔직히 사랑니 빼는거 괜찮을까 걱정 많았구 제가 미주신경성 실신이 있어서 마취하거나 주사맞으면 꼭 쓰러졌거든요.. 마취주사도 저는 쫌 아팠구 아래 사랑니 뽑을때 턱도 시리고 해서 괴로웠는데 실신을 안 했어요..!!!! 계속 제 상태 확인해주시면서 진행해주셔서 그런가봐요 ㅎㅎ 이도 마취 풀리고 잠깐 한 10분정도 아프고 괜찮아져서 치킨도 먹고 그랫어요...ㅋㅋㅋㅋㅋㅋ 간호사선생님들 치위생사 선생님들 의사선생님 다 너무 친절하셔서 제가 엄청 징징댔는데 다 받아주시규... 걱정 많이 해주시구ㅜㅜ 감사해여ㅠㅠㅠㅠㅠㅠ 아직 오른쪽이 남았다는 사실이 너무 절망적이지만 오른쪽 위아래도 꼭 라이크치과에서 뺄거에요ㅠ,,
