bookingBusinessId,reviewId,reviewBody,score,isImp,replyBody,resourceUrlList/0,completedDate,id,bookingItemName,bookingBusinessName,optionNameList,body/0/isHighlight,body/0/text,resourceUrlList/1,replyRegDate
158179,4880286,"주말에 월요일오전으로 예약한거라서 예약확정이 되려나 걱정했는데, 확정이 금방 나서 다녀왔어요.
지하철에서 늦게 내려서 3분정도 늦게 도착했는데, 친절하게 예약시간에 전화해서 확인해주시고 저는 평일 오전이라 대기 5분 안에 진료 시작했어요.
엑스레이->마취크림(감각이 사라짐..)->저는 사랑니가 누워있어서 CT도 찍고 미세 어쩌구도 찍었어요! 스케일링도 같이 했는데 사랑니 뽑는것보다 스케일링이 더 아팠던 것 같아요.
사랑니 뽑기 전에 잇몸에 마취주사 놓아주시는데 따끔하다고 말씀도 해주시고 사랑니를 땡기는 느낌은 나지만 통증은 없어요. 소리는 엄청 크긴한데 소리만 큽니다! 그러다가 순식간에 꼬매주심... + 엉덩이주사로 마무리
세시간뒤에 전화도 해주시고 정말 친절하세요! 나머지 하나도 여기서 뽑으려고요 ㅎ",5,1,,,2019.04.29,eksk****,라이크치과,라이크치과의원,,false,"주말에 월요일오전으로 예약한거라서 예약확정이 되려나 걱정했는데, 확정이 금방 나서 다녀왔어요.
지하철에서 늦게 내려서 3분정도 늦게 도착했는데, 친절하게 예약시간에 전화해서 확인해주시고 저는 평일 오전이라 대기 5분 안에 진료 시작했어요.
엑스레이->마취크림(감각이 사라짐..)->저는 사랑니가 누워있어서 CT도 찍고 미세 어쩌구도 찍었어요! 스케일링도 같이 했는데 사랑니 뽑는것보다 스케일링이 더 아팠던 것 같아요.
사랑니 뽑기 전에 잇몸에 마취주사 놓아주시는데 따끔하다고 말씀도 해주시고 사랑니를 땡기는 느낌은 나지만 통증은 없어요. 소리는 엄청 크긴한데 소리만 큽니다! 그러다가 순식간에 꼬매주심... + 엉덩이주사로 마무리
세시간뒤에 전화도 해주시고 정말 친절하세요! 나머지 하나도 여기서 뽑으려고요 ㅎ",,
158179,4902946,"사랑니 처음 뽑아보는거라 무서웠는데ㅠㅠ 간호사선생님 너무 친절하시고 긴장 풀어주려고 하셔서 너무 감사했어요! 사랑니 뽑기 전 마취크림 바르고 마취 주사 하니까 훨씬 덜 아프고 일단 사랑니 뽑는게 거의 5분컷.. 아아앗.. 하다보면 갑자기 일어나서 물양치하라고 하세요.. 넘 빨라서 어리둥절,, 그리고 다른 치료 권하지 않고 딱 문의드린 것만 말씀해주셔서 너무 좋았어여ㅠㅠ 맨날 치과가면 뭐해라 뭐해라 해서 거절하기 민망했는데 진짜 하나도 안 불편하고 잘 챙겨주셔서 너무 감사했습니다ㅠㅠ! 뽑고 나서도 몇번이고 주의사항 알려주시고 퇴근하고서 전화까지 주시고...! 넘 좋았어여 진짜로 제가 사랑니 10개가 난다면 다 여기서 뽑을것같아요 최고!!",5,1,,,2019.04.29,abso****,라이크치과,라이크치과의원,,false,"사랑니 처음 뽑아보는거라 무서웠는데ㅠㅠ 간호사선생님 너무 친절하시고 긴장 풀어주려고 하셔서 너무 감사했어요! 사랑니 뽑기 전 마취크림 바르고 마취 주사 하니까 훨씬 덜 아프고 일단 사랑니 뽑는게 거의 5분컷.. 아아앗.. 하다보면 갑자기 일어나서 물양치하라고 하세요.. 넘 빨라서 어리둥절,, 그리고 다른 치료 권하지 않고 딱 문의드린 것만 말씀해주셔서 너무 좋았어여ㅠㅠ 맨날 치과가면 뭐해라 뭐해라 해서 거절하기 민망했는데 진짜 하나도 안 불편하고 잘 챙겨주셔서 너무 감사했습니다ㅠㅠ! 뽑고 나서도 몇번이고 주의사항 알려주시고 퇴근하고서 전화까지 주시고...! 넘 좋았어여 진짜로 제가 사랑니 10개가 난다면 다 여기서 뽑을것같아요 최고!!",,
158179,4847238,"매복사랑니가 오른쪽왼쪽 다 나있엇어요!!
일반치과에선 대형병원 가라고하더라구요...몇몇치과에서 거절당했는데 라이크 치과는
바로 오케이해줬어요!!ㅎㅎㅎㅎ
한달전에 오른쪽 매복 뽑을때 너무무서웠는데 간호사분이 너무친절하게 설명도 잘하주시고 3시간후에 전화하셔서 지혈됐나 확인도해주셧어요! 지혈이 약간 안되어있었는데 다시 지혈법 알려주시고선 제가 지혈다될때까지 기다려주셧어요...ㅠㅠ 너무감사햇어요 그리고 소독도, 실밥푸는것도 다 친절했어요!

그리고선 왼쪽 뽑으러갔는데 제가오른쪽뽑을때 어려워했거나 불편해한점들을 잘기억해주시면서 왼쪽을 뽑아주셨어요! 10분만에 뚝딱....선생님의 능력에 박수를...전혀 아프지도않았고 금방뚝딱뽑았네요!!

그이후 간호사분의지혈 확인과 섬세한 설명도 너무 감사햇습니다!! 짱짱ㅇ예요♡",5,1,,,2019.04.26,rlag****,라이크치과,라이크치과의원,,false,"매복사랑니가 오른쪽왼쪽 다 나있엇어요!!
일반치과에선 대형병원 가라고하더라구요...몇몇치과에서 거절당했는데 라이크 치과는
바로 오케이해줬어요!!ㅎㅎㅎㅎ
한달전에 오른쪽 매복 뽑을때 너무무서웠는데 간호사분이 너무친절하게 설명도 잘하주시고 3시간후에 전화하셔서 지혈됐나 확인도해주셧어요! 지혈이 약간 안되어있었는데 다시 지혈법 알려주시고선 제가 지혈다될때까지 기다려주셧어요...ㅠㅠ 너무감사햇어요 그리고 소독도, 실밥푸는것도 다 친절했어요!

그리고선 왼쪽 뽑으러갔는데 제가오른쪽뽑을때 어려워했거나 불편해한점들을 잘기억해주시면서 왼쪽을 뽑아주셨어요! 10분만에 뚝딱....선생님의 능력에 박수를...전혀 아프지도않았고 금방뚝딱뽑았네요!!

그이후 간호사분의지혈 확인과 섬세한 설명도 너무 감사햇습니다!! 짱짱ㅇ예요♡",,
158179,4830101,두번째 사랑니 뽑으러 다시 방문했는데 친절하고 안아프게 잘뽑았습니다! 주변에도 추천해주고 싶은 치과!,5,1,,,2019.04.25,dpdl****,라이크치과,라이크치과의원,,false,두번째 사랑니 뽑으러 다시 방문했는데 친절하고 안아프게 잘뽑았습니다! 주변에도 추천해주고 싶은 치과!,,
158179,4810527,사랑니 뽑으러 갔는데 엄청 겁 먹었던게 무안 할 정도로 아프지 않고 신속하게 발치 되어 놀랬어요! 친절한 설명과 치료 후 상태 확인 전화까지 되게 잘해주셨어요 짱짱 !,5,1,,,2019.04.23,jany****,라이크치과,라이크치과의원,,false,사랑니 뽑으러 갔는데 엄청 겁 먹었던게 무안 할 정도로 아프지 않고 신속하게 발치 되어 놀랬어요! 친절한 설명과 치료 후 상태 확인 전화까지 되게 잘해주셨어요 짱짱 !,,
158179,4855509,"매복 사랑니 두 개 전부 여기서 뺐고 치아교정도 하는중인데 진짜 요기에 뼈 묻을거에요ㅠㅠ달에 한번 교정 월치료 갈때마다 불편한점 없었는지 괜찮았는지 상냥하게 살펴주셔서 교정원장님 뵙기전부터 너무 따숩고...원장님도 교정 진행상태 꼼꼼하게 봐주시고 오늘 뭐했는지,  앞으로 어떻게 할건지 자세하게 설명해주셔서 신뢰감 뿜뿜 최고에요????사랑니 발치때도 매복이라 겁 엄청 집어먹었는데...마취크림 먼저 발라주셔서 마취주사도 안아팠고 발치는 정말 휘리릭뚝딱 뽑아주셔서 하나도 안아팠어요ㅋㅋㅋㅋ나중에 지혈 잘됐나 확인전화도 주시고 소독이랑 실밥풀고 하는것도 전부 너무너무너무 잘 챙겨주셔서 감동이었어요????이렇게 친절한곳 처음이에요 방문할때마다 기분 좋구ㅠㅠ세상 사람들 전부 라이크치과 갔으면 좋겠다...",5,1,,https://naverbooking-phinf.pstatic.net/20190428_266/1556436365249aOpe5_PNG/image.png,2019.04.23,yooj****,라이크치과,라이크치과의원,,false,"매복 사랑니 두 개 전부 여기서 뺐고 치아교정도 하는중인데 진짜 요기에 뼈 묻을거에요ㅠㅠ달에 한번 교정 월치료 갈때마다 불편한점 없었는지 괜찮았는지 상냥하게 살펴주셔서 교정원장님 뵙기전부터 너무 따숩고...원장님도 교정 진행상태 꼼꼼하게 봐주시고 오늘 뭐했는지,  앞으로 어떻게 할건지 자세하게 설명해주셔서 신뢰감 뿜뿜 최고에요????사랑니 발치때도 매복이라 겁 엄청 집어먹었는데...마취크림 먼저 발라주셔서 마취주사도 안아팠고 발치는 정말 휘리릭뚝딱 뽑아주셔서 하나도 안아팠어요ㅋㅋㅋㅋ나중에 지혈 잘됐나 확인전화도 주시고 소독이랑 실밥풀고 하는것도 전부 너무너무너무 잘 챙겨주셔서 감동이었어요????이렇게 친절한곳 처음이에요 방문할때마다 기분 좋구ㅠㅠ세상 사람들 전부 라이크치과 갔으면 좋겠다...",https://naverbooking-phinf.pstatic.net/20190428_46/1556431605953eH0Pv_JPEG/image.jpg,
158179,4807807,사랑니 발치 2번째인데 진짜 하나도 안아파서 신기해요..!!????,5,1,,,2019.04.22,tozh****,라이크치과,라이크치과의원,,false,사랑니 발치 2번째인데 진짜 하나도 안아파서 신기해요..!!????,,
158179,4811733,"앞에 카운터에 계신 여자 선생님들 너무너무너무 친절하세요ㅠㅠ 추천 받고 간건데 사랑니 하나도 안 아프게 발치했어요 아니 일단 선생님들 너무 친절하시고,,원장님도 사랑니 잘 뽑으시고!!! 약간 치과가면 혼날거 같다..? 이런 걱정하면서 가잖아요 근데 너무 친절하셔서 감동이었어요 추천합니다~! 사랑니뽑고 충치 치료도 했는데 뭔가 과잉 진료는 안 하시는 것 같았어요 말씀하시는거 들어보면! 사실 뭐 치과 잘 몰라서 정확하진 않지만..허헣",5,1,,,2019.04.22,ysb3****,라이크치과,라이크치과의원,,false,"앞에 카운터에 계신 여자 선생님들 너무너무너무 친절하세요ㅠㅠ 추천 받고 간건데 사랑니 하나도 안 아프게 발치했어요 아니 일단 선생님들 너무 친절하시고,,원장님도 사랑니 잘 뽑으시고!!! 약간 치과가면 혼날거 같다..? 이런 걱정하면서 가잖아요 근데 너무 친절하셔서 감동이었어요 추천합니다~! 사랑니뽑고 충치 치료도 했는데 뭔가 과잉 진료는 안 하시는 것 같았어요 말씀하시는거 들어보면! 사실 뭐 치과 잘 몰라서 정확하진 않지만..허헣",,
158179,4855296,친절하시고 깔끔하게 필요한 치료만 해주셨어요~!,5,1,,,2019.04.22,aaa1****,라이크치과,라이크치과의원,,false,친절하시고 깔끔하게 필요한 치료만 해주셨어요~!,,
158179,4802853,"매복사랑니가 신경이랑 가까이 있다고해서 걱정 많이했는데, 하나도 안아프게 잘뽑았어요.
역 바로앞에있어서 접근성도 좋아 쉽게 찾을 수 있었고 내부도 환하고 넓어서 쾌적하더라구요 :-)
직원분들도 주의사항이나 안내사항 꼼꼼하게 말씀해주시고 한명한명 신경써주시는거같아서
마음이 놓였어요 ! 특히 마취하기 전에 마취크림 바르고, 진통제 챙겨주시는 부분도 섬세하다고 느껴졌구요
마취크림덕에 주사도 많이 안아프고 마취기다리는 시간이랑 스케일링 시간때문에 1시간정도 걸린거같은데
막상 뽑는시간은 10분?도 안걸렸던거같아요 ! 의사선생님 실력 짱짱 bbbb
토요일 오후에 방문했는데 직원분이 퇴근후에도 괜찮은지 따로연락주시는거 보고 감동했네요ㅠㅠㅠㅠ
아직 매복사랑니 하나 더 남았는데 담음달에 또 뽑으러갈게요!!",5,1,,https://naverbooking-phinf.pstatic.net/20190423_40/1555979892318bkM0y_JPEG/KakaoTalk_20190423_093337609.jpg,2019.04.20,sh__****,라이크치과,라이크치과의원,,false,"매복사랑니가 신경이랑 가까이 있다고해서 걱정 많이했는데, 하나도 안아프게 잘뽑았어요.
역 바로앞에있어서 접근성도 좋아 쉽게 찾을 수 있었고 내부도 환하고 넓어서 쾌적하더라구요 :-)
직원분들도 주의사항이나 안내사항 꼼꼼하게 말씀해주시고 한명한명 신경써주시는거같아서
마음이 놓였어요 ! 특히 마취하기 전에 마취크림 바르고, 진통제 챙겨주시는 부분도 섬세하다고 느껴졌구요
마취크림덕에 주사도 많이 안아프고 마취기다리는 시간이랑 스케일링 시간때문에 1시간정도 걸린거같은데
막상 뽑는시간은 10분?도 안걸렸던거같아요 ! 의사선생님 실력 짱짱 bbbb
토요일 오후에 방문했는데 직원분이 퇴근후에도 괜찮은지 따로연락주시는거 보고 감동했네요ㅠㅠㅠㅠ
아직 매복사랑니 하나 더 남았는데 담음달에 또 뽑으러갈게요!!",https://naverbooking-phinf.pstatic.net/20190423_42/1555979892672EyUbJ_JPEG/KakaoTalk_20190423_093335891.jpg,
158179,4775850,사랑니 처음 빼는거여서 겁먹었는데 생각보다 안아팠어요!!내부도 깨끗하고 직원분들도 친절하셔서 좋았어요,5,1,,,2019.04.19,hyew****,라이크치과,라이크치과의원,,false,사랑니 처음 빼는거여서 겁먹었는데 생각보다 안아팠어요!!내부도 깨끗하고 직원분들도 친절하셔서 좋았어요,,
158179,4782127,대기실도 넓고 예약하고 가니깐 안 기다리고 좋았어요. 선생님들 다 너무 친절하셨어요~ 매복사랑니라 너무 쫄아서 갔는데 안 아프게 해주셔서 너무 감사합니당 덕분에 제 사랑니는 다 뽑았어요~,4,1,,,2019.04.19,rty0****,라이크치과,라이크치과의원,,false,대기실도 넓고 예약하고 가니깐 안 기다리고 좋았어요. 선생님들 다 너무 친절하셨어요~ 매복사랑니라 너무 쫄아서 갔는데 안 아프게 해주셔서 너무 감사합니당 덕분에 제 사랑니는 다 뽑았어요~,,
158179,4769082,사랑니뽑기 되게 좋은병원인거같아요!지혈됐는지 확인전화해주셔서 너무 감동했오요 ㅠㅠ 문자도 보내주시고... 2~3주 뒤에 또 반대편 사랑니 뽑으러 가는데 다시 해야하는게 무섭지만 또 여기로 갈려구요!! 뽑을때 자체는 별로 안아파요ㅋㅋ소리만 무서움ㅋㅋㅋ,5,1,,,2019.04.19,jiso****,라이크치과,라이크치과의원,,false,사랑니뽑기 되게 좋은병원인거같아요!지혈됐는지 확인전화해주셔서 너무 감동했오요 ㅠㅠ 문자도 보내주시고... 2~3주 뒤에 또 반대편 사랑니 뽑으러 가는데 다시 해야하는게 무섭지만 또 여기로 갈려구요!! 뽑을때 자체는 별로 안아파요ㅋㅋ소리만 무서움ㅋㅋㅋ,,
158179,5107594,"안아팠어요
근데... ct 굳이안찍어도되는데찍으시네용
심지어 이뽑고나서 씨티찍었어요",5,1,,,2019.04.19,wind****,라이크치과,라이크치과의원,,false,"안아팠어요
근데... ct 굳이안찍어도되는데찍으시네용
심지어 이뽑고나서 씨티찍었어요",,
158179,4755357,Just fine,3,1,,,2019.04.16,ssjl****,라이크치과,라이크치과의원,,false,Just fine,,
158179,4752243,너무 친절했어요 ㅜㅜ 깔끔하고 짱,5,1,,,2019.04.16,meu9****,라이크치과,라이크치과의원,,false,너무 친절했어요 ㅜㅜ 깔끔하고 짱,,
158179,4754921,"지난 여름에 라이크 치과에서 오른쪽 아래 사랑니 발치했고 이번엔 왼쪽 아래 사랑니 발치했습니다
둘 다 매복 사랑니였고, 왼쪽이 오른쪽 보다 심한 매복이었는데도 둘 다 뽑을 때도, 뽑고 나서도 통증 하나도 없고 너무 좋았어요~! 
아 마취 주사 전에 마취크림도 너무 좋아여 주사도 안아파여 살짝 따꼼만 합니당
사랑니 발치 아프단 것도 다 옛날 말인가봐요
진통제는 사랑니 발치 전과 발치 후 거즈 뺀 다음 딱 두 번 먹었구여 처방 받은 약 잘 챙겨 먹으니까 진쩌 뭐 없네여,,  라이크 치과 넘 친절하고 발치도 빠르고 좋아여
더 이상 뽑을 사랑니가 없어서 아쉽네여,, ㅠ",5,1,,,2019.04.15,98tk****,라이크치과,라이크치과의원,,false,"지난 여름에 라이크 치과에서 오른쪽 아래 사랑니 발치했고 이번엔 왼쪽 아래 사랑니 발치했습니다
둘 다 매복 사랑니였고, 왼쪽이 오른쪽 보다 심한 매복이었는데도 둘 다 뽑을 때도, 뽑고 나서도 통증 하나도 없고 너무 좋았어요~! 
아 마취 주사 전에 마취크림도 너무 좋아여 주사도 안아파여 살짝 따꼼만 합니당
사랑니 발치 아프단 것도 다 옛날 말인가봐요
진통제는 사랑니 발치 전과 발치 후 거즈 뺀 다음 딱 두 번 먹었구여 처방 받은 약 잘 챙겨 먹으니까 진쩌 뭐 없네여,,  라이크 치과 넘 친절하고 발치도 빠르고 좋아여
더 이상 뽑을 사랑니가 없어서 아쉽네여,, ㅠ",,
158179,4744855,매복사랑니라 무서워서 계속 미루다가 주변 사람한테 라이크치과가 잘한다고 해서 갔는데 진작 여기서 뽑을걸 그랬어요!! 치과도 정말 크고깨끗한 느낌? 장비도 최신식이라서 좋더라구요. 사랑니 2개 뽑는데 몇분도 안걸린거같아요 하나도 안아파서 뽑은지도 몰랐을 정도.. 의사선생님이랑 위생사분들도 정말 친절하시고 마취도 꼼꼼히 확인해주시고 끝나고 전화로 상태도 물어봐주시고 정말 친절하게 상담해주셔서 좋았어요!! 가격도 저렴하구요. 친구들한테도 여기서 뽑으라고 저도 모르게 홍보했어요ㅋㅋ 뽑고 나서도 하나도 안아프구요 오른쪽 아물면 왼쪽 사랑니도 뽑으려구요~~,5,1,,https://naverbooking-phinf.pstatic.net/20190417_238/1555438464104GejQD_JPEG/image.jpg,2019.04.15,ekdu****,라이크치과,라이크치과의원,,false,매복사랑니라 무서워서 계속 미루다가 주변 사람한테 라이크치과가 잘한다고 해서 갔는데 진작 여기서 뽑을걸 그랬어요!! 치과도 정말 크고깨끗한 느낌? 장비도 최신식이라서 좋더라구요. 사랑니 2개 뽑는데 몇분도 안걸린거같아요 하나도 안아파서 뽑은지도 몰랐을 정도.. 의사선생님이랑 위생사분들도 정말 친절하시고 마취도 꼼꼼히 확인해주시고 끝나고 전화로 상태도 물어봐주시고 정말 친절하게 상담해주셔서 좋았어요!! 가격도 저렴하구요. 친구들한테도 여기서 뽑으라고 저도 모르게 홍보했어요ㅋㅋ 뽑고 나서도 하나도 안아프구요 오른쪽 아물면 왼쪽 사랑니도 뽑으려구요~~,,
158179,4715045,만족합니다 엄살 심해서 무서웠는데 위생사 선생님께서 안심시켜주시고 많은 질문에도 대답도 잘해주시고 너무 친절하고 이도 너무 잘 뽑아서 좋았습니다,5,1,,,2019.04.13,xopp****,라이크치과,라이크치과의원,,false,만족합니다 엄살 심해서 무서웠는데 위생사 선생님께서 안심시켜주시고 많은 질문에도 대답도 잘해주시고 너무 친절하고 이도 너무 잘 뽑아서 좋았습니다,,
158179,4696577,친절하시고 정말 좋았어요. 매복 사랑니 뽑다가 죽으면 어떻게하지 걱정했는데 이렇게 살아서 리뷰도 쓰네요 행복합니다 ㅎㅎㅎ,5,1,,,2019.04.11,ghdt****,라이크치과,라이크치과의원,,false,친절하시고 정말 좋았어요. 매복 사랑니 뽑다가 죽으면 어떻게하지 걱정했는데 이렇게 살아서 리뷰도 쓰네요 행복합니다 ㅎㅎㅎ,,
158179,4695955,"매복사랑니 어디에서 뽑아야할지 고민 많이 했었는데, 라이크 치과에서 뽑길 잘 한 것 같아요. 친절하게 대해주시고,  발치 이후에도 많이 신경써주셔서 감사했습니다! 남은 사랑니 3개도 여기서 뽑아야겠어요??",5,1,,,2019.04.11,0107****,라이크치과,라이크치과의원,,false,"매복사랑니 어디에서 뽑아야할지 고민 많이 했었는데, 라이크 치과에서 뽑길 잘 한 것 같아요. 친절하게 대해주시고,  발치 이후에도 많이 신경써주셔서 감사했습니다! 남은 사랑니 3개도 여기서 뽑아야겠어요??",,
158179,4679772,서비스도 친절하고 사랑니 발치도 안아프게 잘 뽑아주셨어요~,5,1,,,2019.04.09,cool****,라이크치과,라이크치과의원,,false,서비스도 친절하고 사랑니 발치도 안아프게 잘 뽑아주셨어요~,,
158179,4686997,친절하시고 병원도 깨끗하고 깔끔해요 사랑니뽑았는데 아프지도않고 좋았어용 반대쪽사랑니도 여기서 뽑을듯 ㅎ.ㅎ,5,1,,,2019.04.09,seul****,라이크치과,라이크치과의원,,false,친절하시고 병원도 깨끗하고 깔끔해요 사랑니뽑았는데 아프지도않고 좋았어용 반대쪽사랑니도 여기서 뽑을듯 ㅎ.ㅎ,,
158179,4821674,"앞니가 부러져서 가슴이 철렁했었는데 늦은밤에도 카톡상담해주시고 위로해주셔서 너무 감사했습니다.
다른데 다친데는 없냐고 걱정해주시고ㅠ넘따숩..ㅠ
앞니 두개 신경치료하고 치아만들어서 붙였는데 원래 제 앞니보다 이뻐져서 좋습니다^^
정말 너무 강추합니다~!!!!",5,1,,,2019.04.08,dehe****,라이크치과,라이크치과의원,,false,"앞니가 부러져서 가슴이 철렁했었는데 늦은밤에도 카톡상담해주시고 위로해주셔서 너무 감사했습니다.
다른데 다친데는 없냐고 걱정해주시고ㅠ넘따숩..ㅠ
앞니 두개 신경치료하고 치아만들어서 붙였는데 원래 제 앞니보다 이뻐져서 좋습니다^^
정말 너무 강추합니다~!!!!",,
158179,4676083,"제가 여기서 치료받고 안아프게 잘치료해주셔서 
무섭다고 치료 미루고 계신 엄마 모시고 가서 상담받고 바로 수술예약했어요.
겁많으신데 편하게 대해주시고 설명도 자세히 해주셔서 감사합니다~!!!
저는 여기서 치료받고 주변에 추천많이해요~~",5,1,,,2019.04.05,ssr1****,라이크치과,라이크치과의원,,false,"제가 여기서 치료받고 안아프게 잘치료해주셔서 
무섭다고 치료 미루고 계신 엄마 모시고 가서 상담받고 바로 수술예약했어요.
겁많으신데 편하게 대해주시고 설명도 자세히 해주셔서 감사합니다~!!!
저는 여기서 치료받고 주변에 추천많이해요~~",,
158179,4735370,"신촌역 6번 출구로 나오면 바로 있어서 찾아가기도 쉽고, 병원도 크고 시설 좋아요! 의사 선생님 실력 최고! 사랑니 이렇게 빠르게 잘 발치해주는 치과는 처음이에요ㅋㅋㅋ 마취주사 전에 마취크림도 발라주고 진통제도 먼저 챙겨주고 너무 좋아요ㅜㅜ 남은 사랑니도 라이크 치과에서 발치할 생각 200%입니당ㅎ 위생사분들, 데스크 직원분들도 정말정말 친절하세요! 그리구 동네 다른 병원에서 14만원 달라는거.. 라이크에서 스케일링까지 해서 4만9천원에 뽑았어요 최고ㅠㅋㅋㅋ 사랑니 때문에 병원 고민이신 분들에 정말정말정말 추천합니다????",5,1,,,2019.04.05,sora****,라이크치과,라이크치과의원,,false,"신촌역 6번 출구로 나오면 바로 있어서 찾아가기도 쉽고, 병원도 크고 시설 좋아요! 의사 선생님 실력 최고! 사랑니 이렇게 빠르게 잘 발치해주는 치과는 처음이에요ㅋㅋㅋ 마취주사 전에 마취크림도 발라주고 진통제도 먼저 챙겨주고 너무 좋아요ㅜㅜ 남은 사랑니도 라이크 치과에서 발치할 생각 200%입니당ㅎ 위생사분들, 데스크 직원분들도 정말정말 친절하세요! 그리구 동네 다른 병원에서 14만원 달라는거.. 라이크에서 스케일링까지 해서 4만9천원에 뽑았어요 최고ㅠㅋㅋㅋ 사랑니 때문에 병원 고민이신 분들에 정말정말정말 추천합니다????",,
158179,4748541,"작년에 치료받고 편안했던 기억이 있어서 앞니치료도 받았어요.
앞니라 빨리 치료했어야 했는데 만족스러워요. 하루에 다 씌우는 치료 했어요.
모양도 이쁘고 색깔도 자연스럽고 정말 만족합니다!^^",5,1,,,2019.04.04,tahy****,라이크치과,라이크치과의원,,false,"작년에 치료받고 편안했던 기억이 있어서 앞니치료도 받았어요.
앞니라 빨리 치료했어야 했는데 만족스러워요. 하루에 다 씌우는 치료 했어요.
모양도 이쁘고 색깔도 자연스럽고 정말 만족합니다!^^",,
158179,4807547,"뼈가 많이 없어서 뼈이식 수술하고 임플란트 했는데 이제 크라운만 만들면되요.
몇달동안 다른 치료도 받았는데 편안하게 해줘서 고마웠어요.
직원들도 알아듣기 쉽게 설명하려고 노력하고 성실하고 밝아요.
불편한 점도 잘 살피고 배려해줍니다.",5,1,,,2019.04.04,haya****,라이크치과,라이크치과의원,,false,"뼈가 많이 없어서 뼈이식 수술하고 임플란트 했는데 이제 크라운만 만들면되요.
몇달동안 다른 치료도 받았는데 편안하게 해줘서 고마웠어요.
직원들도 알아듣기 쉽게 설명하려고 노력하고 성실하고 밝아요.
불편한 점도 잘 살피고 배려해줍니다.",,
