bookingBusinessId,reviewId,reviewBody,score,isImp,replyBody,resourceUrlList/0,completedDate,id,bookingItemName,bookingBusinessName,optionNameList,body/0/isHighlight,body/0/text,resourceUrlList/1,replyRegDate
158179,4052052,완전 만족합니다. 의사 선생님도 친절하시고 데스크 선생님들도 친절하세요! 주위에서 사랑니 뽑는다고하면 꼭 추천해주고싶은 병원이에요,5,1,,,2019.01.29,milk****,라이크치과,라이크치과의원,,false,완전 만족합니다. 의사 선생님도 친절하시고 데스크 선생님들도 친절하세요! 주위에서 사랑니 뽑는다고하면 꼭 추천해주고싶은 병원이에요,,
158179,4114983,넘넘 친절하시고 사랑니 뽑는데 하나도 안아팠어요!! 다음 사랑니도 여기다...!,5,1,,,2019.01.28,jiun****,라이크치과,라이크치과의원,,false,넘넘 친절하시고 사랑니 뽑는데 하나도 안아팠어요!! 다음 사랑니도 여기다...!,,
158179,4032890,"간호사님(특히 첫날에 저 맡아주신 얼굴동그라시고 앞머리 없고 머리묶으신 분) 짱짱 친절하시고 좋았어요.
그리고 사랑니 발치랑 충치치료 둘다 했는데 안아프고 좋았어요.
다시 이용하고싶어요!!",5,1,,,2019.01.26,gksm****,라이크치과,라이크치과의원,,false,"간호사님(특히 첫날에 저 맡아주신 얼굴동그라시고 앞머리 없고 머리묶으신 분) 짱짱 친절하시고 좋았어요.
그리고 사랑니 발치랑 충치치료 둘다 했는데 안아프고 좋았어요.
다시 이용하고싶어요!!",,
158179,4000142,너무깔끔하고 무엇보다 직원분들 의사선생님 다 친절하셔서 좋습니다!!!,5,1,,,2019.01.23,maro****,라이크치과,라이크치과의원,,false,너무깔끔하고 무엇보다 직원분들 의사선생님 다 친절하셔서 좋습니다!!!,,
158179,3994692,사랑니 뽑았는데 엄청 빨리 뽑아서 붓기도 없고 마취풀리고도 거의 안아팠어요! 안내도 엄청 친절하게 해주시고 좋았습니다 ㅎㅎ,5,1,,,2019.01.22,almo****,라이크치과,라이크치과의원,,false,사랑니 뽑았는데 엄청 빨리 뽑아서 붓기도 없고 마취풀리고도 거의 안아팠어요! 안내도 엄청 친절하게 해주시고 좋았습니다 ㅎㅎ,,
158179,3993737,사랑니 뽑으러 다녀왔어요! 처음이라 긴장했는데 안아프게 몇초만에 딱 뽑아주셔서 좋았어요 친절하시구!! ^_^,5,1,,,2019.01.22,5322****,라이크치과,라이크치과의원,,false,사랑니 뽑으러 다녀왔어요! 처음이라 긴장했는데 안아프게 몇초만에 딱 뽑아주셔서 좋았어요 친절하시구!! ^_^,,
158179,3984912,"매복사랑니 뽑았어요!
잇몸절개 뼈절 다했는데
진짜 하나도 안아팠어요..
원장쌤이랑 치위생사 언니들 얼마나 친절하고 차분하신지.. 거기다가 실력까지 최고세요
앞으로 치과추천은 여기로 꼭 하려구요 !!
좋은치료 감사합니다~!",5,1,,,2019.01.21,coco****,라이크치과,라이크치과의원,,false,"매복사랑니 뽑았어요!
잇몸절개 뼈절 다했는데
진짜 하나도 안아팠어요..
원장쌤이랑 치위생사 언니들 얼마나 친절하고 차분하신지.. 거기다가 실력까지 최고세요
앞으로 치과추천은 여기로 꼭 하려구요 !!
좋은치료 감사합니다~!",,
158179,3967807,매복이랑 일반 사랑니 뽑았는데 최고에여,5,1,,,2019.01.19,jooh****,라이크치과,라이크치과의원,,false,매복이랑 일반 사랑니 뽑았는데 최고에여,,
158179,3947533,다들 친절하시고  스케일링을 받았는데 엄청 시원하게 잘받았어요 담당분이 친절하고 시원하고 안아프게 ㅋㅋ 병원이 엄청 크더라구요 조만간 충치치료하러 갈예정,5,1,,,2019.01.17,heme****,라이크치과,라이크치과의원,,false,다들 친절하시고  스케일링을 받았는데 엄청 시원하게 잘받았어요 담당분이 친절하고 시원하고 안아프게 ㅋㅋ 병원이 엄청 크더라구요 조만간 충치치료하러 갈예정,,
158179,3941234,"매복사랑니 뽑으러 갔는데 진짜 친절하고 신속하게 뽑아주셨어요!! 신경이랑 붙어있어서 뽑기전에 CT찍어야 돼서 좀 불안했는데 괜한 걱정이었고 체감시간 3분도 안 걸린 것 같아요 발치 전에 마취 잘 됐는지도 확인해주셨고 뽑으면서 조금 이빨 시린 타이밍에 딱 ""아프세요?"" 물어봐주시고 마취 더해주셔서 뽑을 때 아무느낌도 없었어요 ㅋㅋㅋ 사후관리도 너무 잘해주셔서 친구들한테 여기 소문내고 다닐거예요!!",5,1,,,2019.01.16,twst****,라이크치과,라이크치과의원,,false,"매복사랑니 뽑으러 갔는데 진짜 친절하고 신속하게 뽑아주셨어요!! 신경이랑 붙어있어서 뽑기전에 CT찍어야 돼서 좀 불안했는데 괜한 걱정이었고 체감시간 3분도 안 걸린 것 같아요 발치 전에 마취 잘 됐는지도 확인해주셨고 뽑으면서 조금 이빨 시린 타이밍에 딱 ""아프세요?"" 물어봐주시고 마취 더해주셔서 뽑을 때 아무느낌도 없었어요 ㅋㅋㅋ 사후관리도 너무 잘해주셔서 친구들한테 여기 소문내고 다닐거예요!!",,
158179,3941809,"둘다 완전 매복인데 안아프게 잘해주셨어요! 다른 치과에서 뽑았을때 너무 아파서 겁먹었는데...진짜 하나도 안아프고! 
완전 친절하셔요! 굿굿",5,1,,,2019.01.16,thwj****,라이크치과,라이크치과의원,,false,"둘다 완전 매복인데 안아프게 잘해주셨어요! 다른 치과에서 뽑았을때 너무 아파서 겁먹었는데...진짜 하나도 안아프고! 
완전 친절하셔요! 굿굿",,
158179,3940461,사랑니 뽑고 왔는데 제 경우가 특이한 케이스인지 너무 아프더라고요..ㅠㅠ 그래도 붓기는 없어서 다행입니다ㅠ 다 친절하시고 설명 자세히 해주셔서 좋았습니다,3,1,,,2019.01.16,dgw2****,라이크치과,라이크치과의원,,false,사랑니 뽑고 왔는데 제 경우가 특이한 케이스인지 너무 아프더라고요..ㅠㅠ 그래도 붓기는 없어서 다행입니다ㅠ 다 친절하시고 설명 자세히 해주셔서 좋았습니다,,
158179,3939042,매복 사랑니뽑고 왔는데 진짜 안아파요!!,5,1,,,2019.01.15,gold****,라이크치과,라이크치과의원,,false,매복 사랑니뽑고 왔는데 진짜 안아파요!!,,
158179,3885400,사랑니 뽑고왓는데 정말 친절하고 편안하게 해주셔서 잘 뽑고왓어요,5,1,,,2019.01.09,riot****,라이크치과,라이크치과의원,,false,사랑니 뽑고왓는데 정말 친절하고 편안하게 해주셔서 잘 뽑고왓어요,,
158179,3882453,다들 너무 친절하셔서 좋았어요!! 매복 사랑니 뽑았는데 첫날만 마취풀리면서 아프고 담날부터 말짱하게 다닐 수 있었어요 얼굴 거의 안붓고 ㅎㅎ 감사합니다~~,5,1,,,2019.01.10,happ****,라이크치과,라이크치과의원,,false,다들 너무 친절하셔서 좋았어요!! 매복 사랑니 뽑았는데 첫날만 마취풀리면서 아프고 담날부터 말짱하게 다닐 수 있었어요 얼굴 거의 안붓고 ㅎㅎ 감사합니다~~,,
158179,3950755,사랑니 뽑고왔는데 아픈건 어쩔수없는거고 너무 친절하셔서 너무 만족스러웠어요,5,1,,,2019.01.04,gusx****,라이크치과,라이크치과의원,,false,사랑니 뽑고왔는데 아픈건 어쩔수없는거고 너무 친절하셔서 너무 만족스러웠어요,,
158179,3899187,정말 너무친절하시고 사랑니 안아프고 빨리뽑아주세요! 사랑니 뽑을땐 신촌라이크치과로가세요!!,5,1,,,2019.01.03,dbsk****,라이크치과,라이크치과의원,,false,정말 너무친절하시고 사랑니 안아프고 빨리뽑아주세요! 사랑니 뽑을땐 신촌라이크치과로가세요!!,,
158179,3783514,친절하고 좋았습니다,5,1,,,2018.12.27,ryj9****,라이크치과,라이크치과의원,,false,친절하고 좋았습니다,,
158179,3997435,누가 이런 곳은 처음이라고 리뷰 쓰셨던데..절절히 공감합니다 간호사쌤들부터 의사쌤까지 다들 정말 친절하셔서 감동받았어요 앞으로 여기만 다닐 거예요!!,5,1,,,2018.12.27,ljmt****,라이크치과,라이크치과의원,,false,누가 이런 곳은 처음이라고 리뷰 쓰셨던데..절절히 공감합니다 간호사쌤들부터 의사쌤까지 다들 정말 친절하셔서 감동받았어요 앞으로 여기만 다닐 거예요!!,,
158179,3767007,"데스크, 진료실, 주사실 모든 언니들이 엄청 친절하게 해주셔서 정말 정말 좋았습니다. 의사께서 마취도 진짜 꼼꼼하게 해주시고 동네 병원에서는 안된다고 했던 사랑니를 모두 통증 없도록 잘 빼주셨어요ㅎㅎ",5,1,,,2018.12.26,blac****,라이크치과,라이크치과의원,,false,"데스크, 진료실, 주사실 모든 언니들이 엄청 친절하게 해주셔서 정말 정말 좋았습니다. 의사께서 마취도 진짜 꼼꼼하게 해주시고 동네 병원에서는 안된다고 했던 사랑니를 모두 통증 없도록 잘 빼주셨어요ㅎㅎ",,
158179,3726985,앞에 카운터분들이랑 치위생사분 너무 친절하셨어요!! 정말 카운터분들은 이런분들은 처음이야 라고 느낄정도~!! 그에비해 의사쌤은 특별한 얘기없이 ㅠㅠ.. 제대로 검사도 안해주신거 같아서 좀 그랬네요.. 간단한거라서 그러셨나.. 화장실이 급하셨나... 다음 사랑니 발치 받으러 갑니당~,4,1,,https://naverbooking-phinf.pstatic.net/20181223_300/1545526427235fUVBz_JPEG/image.jpg,2018.12.22,shk7****,라이크치과,라이크치과의원,,false,앞에 카운터분들이랑 치위생사분 너무 친절하셨어요!! 정말 카운터분들은 이런분들은 처음이야 라고 느낄정도~!! 그에비해 의사쌤은 특별한 얘기없이 ㅠㅠ.. 제대로 검사도 안해주신거 같아서 좀 그랬네요.. 간단한거라서 그러셨나.. 화장실이 급하셨나... 다음 사랑니 발치 받으러 갑니당~,,
158179,3732654,시설도 좋고 접수해주시는 분도 정말 친절하시고 마지막에 상담해주신 분도 굉장히 친절하셨어요 치료를 한 건 아니지만 충치 검진을 이렇게 꼼꼼히 받아본 건 처음입니다 어금니 표면이 항상 궁금했는데(개인적으로) 사진 찍어서 보여주시는 게 너무 좋았어요 의사선생님은 딱히 좋지도 나쁘지도 않았는데 인포에 계신 분들이 진짜 상냥하시고 친절해서 기분이 좋았습니다,5,1,,,2018.12.21,dv_v****,라이크치과,라이크치과의원,,false,시설도 좋고 접수해주시는 분도 정말 친절하시고 마지막에 상담해주신 분도 굉장히 친절하셨어요 치료를 한 건 아니지만 충치 검진을 이렇게 꼼꼼히 받아본 건 처음입니다 어금니 표면이 항상 궁금했는데(개인적으로) 사진 찍어서 보여주시는 게 너무 좋았어요 의사선생님은 딱히 좋지도 나쁘지도 않았는데 인포에 계신 분들이 진짜 상냥하시고 친절해서 기분이 좋았습니다,,
158179,3672475,"매복 사랑니 발치하러 방문했습니다! 
걱정 많이했는데 빠르게 발치해주셨어요 친절하고 좋습니당",5,1,,,2018.12.15,ye_s****,라이크치과,라이크치과의원,,false,"매복 사랑니 발치하러 방문했습니다! 
걱정 많이했는데 빠르게 발치해주셨어요 친절하고 좋습니당",,
158179,3672037,"병원 깔끔하고 친절해요~ 과잉진료도 없고, 신촌치과는 이제 여기만 갈것같아요!!",5,1,,,2018.12.14,rkdt****,라이크치과,라이크치과의원,,false,"병원 깔끔하고 친절해요~ 과잉진료도 없고, 신촌치과는 이제 여기만 갈것같아요!!",,
158179,3658505,저는 사랑니땜에 간 건 아니라서 우선 조금 더 시간이 지나야 해당 치과가 괜찮은지 안괜찮은지 알 수 잇을듯. 일하시는 분들 친절하십니당,3,1,,,2018.12.11,kitt****,라이크치과,라이크치과의원,,false,저는 사랑니땜에 간 건 아니라서 우선 조금 더 시간이 지나야 해당 치과가 괜찮은지 안괜찮은지 알 수 잇을듯. 일하시는 분들 친절하십니당,,
158179,3658161,"매복사랑니라 걱정많이했는데  잘뽑아주셔서
감사합니당",5,1,,,2018.12.11,klov****,라이크치과,라이크치과의원,,false,"매복사랑니라 걱정많이했는데  잘뽑아주셔서
감사합니당",,
158179,3653366,다들 너무 친절하시고 좋았습니당 사랑니도 당일만 아프고 다음날부터 피도 안나고 안아팠어요! 다음 사랑니도 여기서 뽑을거같아요,5,1,,,2018.12.10,mich****,라이크치과,라이크치과의원,,false,다들 너무 친절하시고 좋았습니당 사랑니도 당일만 아프고 다음날부터 피도 안나고 안아팠어요! 다음 사랑니도 여기서 뽑을거같아요,,
158179,3648719,"사랑니 처음 빼는거라 살짝 긴장했었는데, 매복사랑니인데도 생각보다 오래 안 걸리고 잘 빼주셨어요!  진통제 맞고 거즈 뺄때도 확인 전화주시고, 통증 때문에 급하게 뺀거라 갑자기 예약하고 갔는데도 다들 친절하셔서 너무 좋았습니다~! 무엇보다 다음날 생각보다 많이 붓지 않아서 역시 사랑니는 실력있는 분이 빼야되는구나 다시 한번 감탄했어요ㅋㅋㅋㅋ일주일 뒤에 실밥 빼러 갈때 뵐게요. 나중에ㅠㅠ..반대쪽 사랑니 뽑으러 갈때도 여기서 뽑을거에요",5,1,,,2018.12.08,wgy7****,라이크치과,라이크치과의원,,false,"사랑니 처음 빼는거라 살짝 긴장했었는데, 매복사랑니인데도 생각보다 오래 안 걸리고 잘 빼주셨어요!  진통제 맞고 거즈 뺄때도 확인 전화주시고, 통증 때문에 급하게 뺀거라 갑자기 예약하고 갔는데도 다들 친절하셔서 너무 좋았습니다~! 무엇보다 다음날 생각보다 많이 붓지 않아서 역시 사랑니는 실력있는 분이 빼야되는구나 다시 한번 감탄했어요ㅋㅋㅋㅋ일주일 뒤에 실밥 빼러 갈때 뵐게요. 나중에ㅠㅠ..반대쪽 사랑니 뽑으러 갈때도 여기서 뽑을거에요",,
158179,3613345,"너무 감사해요.  친절하게 잘해주시고!!
피가 안멈춰서 고생했는데 1시간마다 확인전화해주시고.ㅠㅠㅠ 중간에 마취바질때 아팟지만 전반적으러관리가 아주 좋앜ㅅ어요 사랑해요..♡",5,1,,,2018.12.05,anan****,라이크치과,라이크치과의원,,false,"너무 감사해요.  친절하게 잘해주시고!!
피가 안멈춰서 고생했는데 1시간마다 확인전화해주시고.ㅠㅠㅠ 중간에 마취바질때 아팟지만 전반적으러관리가 아주 좋앜ㅅ어요 사랑해요..♡",,
158179,3626102,좋아요. 간호사분들 너무 친절해서 좋았어요~,5,1,,,2018.12.05,jyi0****,라이크치과,라이크치과의원,,false,좋아요. 간호사분들 너무 친절해서 좋았어요~,,
158179,3609384,또 뺐는데 이번이 더 안 아팠어요 너무 쫄았는데 안 아파서 좋았어요,5,1,,,2018.12.04,cart****,라이크치과,라이크치과의원,,false,또 뺐는데 이번이 더 안 아팠어요 너무 쫄았는데 안 아파서 좋았어요,,
158179,3654022,사랑니 발치 잘 되었어요,4,1,,,2018.12.04,shar****,라이크치과,라이크치과의원,,false,사랑니 발치 잘 되었어요,,
158179,3604340,"선생님들 다 너무 친절하세요!!
완전매복사랑니라 뽑기 전에 겁났는데 마취도 안아프게 약 발라주시고 사랑니도 잘 뽑아주시고 뽑고나서도 감동적이었어요 정말 최고예요 진짜 최고예요 스케일링도 최고고 사랑니도 최고고 진짜 최고예요 정말 정말 감사합니다!!!!",5,1,,,2018.12.03,2702****,라이크치과,라이크치과의원,,false,"선생님들 다 너무 친절하세요!!
완전매복사랑니라 뽑기 전에 겁났는데 마취도 안아프게 약 발라주시고 사랑니도 잘 뽑아주시고 뽑고나서도 감동적이었어요 정말 최고예요 진짜 최고예요 스케일링도 최고고 사랑니도 최고고 진짜 최고예요 정말 정말 감사합니다!!!!",,
158179,3574378,"사랑니 뽑는거 너무 무서웠는데 친절하게 해주셔서 좋았어요! 근데 다른 분들은 거즈 뺄 때 전화 주셨다는데 저는 딱히 연락은 안 왔는데 뭘까요...???ㅋㅋㅋㅋ 암튼 전체적으로 병원도 깔끔하고 좋았어요~!~~! 뺄 때는 소리는 무섭지만 막 아프진 않았는데, 빼고 피가 안 멎어서 밥을 못먹어서 약을 늦게 먹었더니 마취 풀려서 엄청 아팠어요ㅠㅠㅠ 다들 마취 깨기 전에 조심하세용 ㅠㅠㅠㅠㅠ 또 궁금한거 물어보면 바로바로 연락 와서 좋았어요??",5,1,,,2018.11.28,yeji****,라이크치과,라이크치과의원,,false,"사랑니 뽑는거 너무 무서웠는데 친절하게 해주셔서 좋았어요! 근데 다른 분들은 거즈 뺄 때 전화 주셨다는데 저는 딱히 연락은 안 왔는데 뭘까요...???ㅋㅋㅋㅋ 암튼 전체적으로 병원도 깔끔하고 좋았어요~!~~! 뺄 때는 소리는 무섭지만 막 아프진 않았는데, 빼고 피가 안 멎어서 밥을 못먹어서 약을 늦게 먹었더니 마취 풀려서 엄청 아팠어요ㅠㅠㅠ 다들 마취 깨기 전에 조심하세용 ㅠㅠㅠㅠㅠ 또 궁금한거 물어보면 바로바로 연락 와서 좋았어요??",,
158179,3566108,사랑니 발치하기에 좋아요,5,1,,,2018.11.28,yjle****,라이크치과,라이크치과의원,,false,사랑니 발치하기에 좋아요,,
158179,3560468,"매복사랑니 발치하러 어제 저녁에 방문했어요! 직장인이라 퇴근 하고가서 뽑을 수 있는게 너무 좋았어요?????♀??? 마취할때도 주사 바로 안놓고 크림 바른 후에 주사 맞으니까 덜아프더라구요! 발치도 한 5분 정도 만에 끝난 거 같아요!! 하나도 안아프게 잘 뽑아주셨어욯ㅎㅎ 그리고 원장님과 다른 선생닌,직원분들도 너무너무 친절하세요ㅠㅠ♥ 그리고 제일 감동이었던 건 밤 12시쯤에 전화를 주셔서는 이제 거즈빼고 처방약 먹으라고 챙겨주시고 지혈은 잘됐는지 주의사항도 또 한 번 얘기해주셔서 ㅠㅠㅠㅠㅠㅠㅠㅠㅠ완존 감동쓰,,,,^^7 남편도 여기 치과 사후관리도 넘 좋다며 ㅎㅎㅎㅎㅎ 그리고 사랑니 발치하면서 치아검진도 받았는데 과잉진료 없이 진철해주셔서 또 한 번 감동?? 라이크 치과는 사랑입니다??",5,1,,,2018.11.27,feel****,라이크치과,라이크치과의원,,false,"매복사랑니 발치하러 어제 저녁에 방문했어요! 직장인이라 퇴근 하고가서 뽑을 수 있는게 너무 좋았어요?????♀??? 마취할때도 주사 바로 안놓고 크림 바른 후에 주사 맞으니까 덜아프더라구요! 발치도 한 5분 정도 만에 끝난 거 같아요!! 하나도 안아프게 잘 뽑아주셨어욯ㅎㅎ 그리고 원장님과 다른 선생닌,직원분들도 너무너무 친절하세요ㅠㅠ♥ 그리고 제일 감동이었던 건 밤 12시쯤에 전화를 주셔서는 이제 거즈빼고 처방약 먹으라고 챙겨주시고 지혈은 잘됐는지 주의사항도 또 한 번 얘기해주셔서 ㅠㅠㅠㅠㅠㅠㅠㅠㅠ완존 감동쓰,,,,^^7 남편도 여기 치과 사후관리도 넘 좋다며 ㅎㅎㅎㅎㅎ 그리고 사랑니 발치하면서 치아검진도 받았는데 과잉진료 없이 진철해주셔서 또 한 번 감동?? 라이크 치과는 사랑입니다??",,
158179,3554292,"어제(26일) 오른쪽 아래 매복 사랑니 발치하고 왔습니다. 신촌에 있는 다른 치과랑 라이크 치과랑 고민 했는데 결론만 말씀 드리면 라이크에서 발치한게 정말 잘한 선택이었던거같아요! 좋았던 점을 정리하자면
1. 비용이 생각보다 많이 안나왔어요.
2.제가 겁이 많아서 걱정 되니깐 이것저것 많이 여쭤봤는데 바쁘신데도 불구하고 엄청 친절하게 설명해주셨어요. 
3. 마취도 엄청 꼼꼼히 해주셔서 엄살쟁이에 겁쟁이인 저도 겁 안먹고 뽑았습니다.
4.치료 후에 주사도 놔주시고 마스크까지 챙겨주신 센스??그리고 집에서 어떻게 대처해야하는지 꼼꼼히 알려주시고 링크도 문자로 보내주셨어요. 또 거즈 뺄때 쯤 전화로 체크해주셨어요.완전 감동??

저는 왼쪽 아래에 하나 더 있다는데 그것도 여기서 뽑으려구요! 완전 강추예요!!!",5,1,,,2018.11.26,ke93****,라이크치과,라이크치과의원,,false,"어제(26일) 오른쪽 아래 매복 사랑니 발치하고 왔습니다. 신촌에 있는 다른 치과랑 라이크 치과랑 고민 했는데 결론만 말씀 드리면 라이크에서 발치한게 정말 잘한 선택이었던거같아요! 좋았던 점을 정리하자면
1. 비용이 생각보다 많이 안나왔어요.
2.제가 겁이 많아서 걱정 되니깐 이것저것 많이 여쭤봤는데 바쁘신데도 불구하고 엄청 친절하게 설명해주셨어요. 
3. 마취도 엄청 꼼꼼히 해주셔서 엄살쟁이에 겁쟁이인 저도 겁 안먹고 뽑았습니다.
4.치료 후에 주사도 놔주시고 마스크까지 챙겨주신 센스??그리고 집에서 어떻게 대처해야하는지 꼼꼼히 알려주시고 링크도 문자로 보내주셨어요. 또 거즈 뺄때 쯤 전화로 체크해주셨어요.완전 감동??

저는 왼쪽 아래에 하나 더 있다는데 그것도 여기서 뽑으려구요! 완전 강추예요!!!",,
158179,3554222,사랑니 처음 뽑는건데 매복 이라 시간이 조금 걸리긴 했지만 크게 아픈느낌은 없었어요 그래도 아예 안아프다고 하기에는... 조금 무리가 있긴해요 대체적으로 만족합니다 다들 친절하다고 하시는데 전 그렇게 친절하다는 느낌은 못받았어요,3,1,,,2018.11.26,glob****,라이크치과,라이크치과의원,,false,사랑니 처음 뽑는건데 매복 이라 시간이 조금 걸리긴 했지만 크게 아픈느낌은 없었어요 그래도 아예 안아프다고 하기에는... 조금 무리가 있긴해요 대체적으로 만족합니다 다들 친절하다고 하시는데 전 그렇게 친절하다는 느낌은 못받았어요,,
158179,3547447,"저번에는 신촌에서 유명한 다른 치과에서 뽑았었고, 남은 두개는 여기서 뽑았어요~!
저의 느낀점은 신촌에 있는 그 치과의 단점들을 보완해서 나온 치과라고 해도 무방할 정도다.. 입니다. 
1. 저번에 갔던 치과에서도 마취가 얼얼하게 잘 되었다고 생각했는데, 이를 쪼개는 과정에서 느낌이 다 나고 아팠어요 ㅠㅠ
이번에는 이를 쪼개는지 잇몸을 쨌는지 뭔지는 모르겠는데 아프지 않아서 좋았어요~~ 그만큼 마취가 잘 됐다는거겠죵ㅎㅎ
2. 그리고 대체로 너무나 친절하시고 꼼꼼하시다는 느낌을 받았어요. 
3. 저번보다 뭔가 약도 많고 주사도 맞고 해서 더 제대로 케어받은 느낌? 이 나네요 ㅎㅎ 비용은 비슷한데 말이죠... 
저는 이제 사랑니가 없지만 지인이 사랑니 뽑아야한다고 하면 여기 추천할거예요 ^^ 감사합니다!",5,1,,,2018.11.24,hell****,라이크치과,라이크치과의원,,false,"저번에는 신촌에서 유명한 다른 치과에서 뽑았었고, 남은 두개는 여기서 뽑았어요~!
저의 느낀점은 신촌에 있는 그 치과의 단점들을 보완해서 나온 치과라고 해도 무방할 정도다.. 입니다. 
1. 저번에 갔던 치과에서도 마취가 얼얼하게 잘 되었다고 생각했는데, 이를 쪼개는 과정에서 느낌이 다 나고 아팠어요 ㅠㅠ
이번에는 이를 쪼개는지 잇몸을 쨌는지 뭔지는 모르겠는데 아프지 않아서 좋았어요~~ 그만큼 마취가 잘 됐다는거겠죵ㅎㅎ
2. 그리고 대체로 너무나 친절하시고 꼼꼼하시다는 느낌을 받았어요. 
3. 저번보다 뭔가 약도 많고 주사도 맞고 해서 더 제대로 케어받은 느낌? 이 나네요 ㅎㅎ 비용은 비슷한데 말이죠... 
저는 이제 사랑니가 없지만 지인이 사랑니 뽑아야한다고 하면 여기 추천할거예요 ^^ 감사합니다!",,
158179,3530098,"매복사랑니 발치 하고 왔는데 위생을 꼼꼼히 신경써주시고, 무엇보다 사후관리에 힘써주시는게 느껴졌어요 신기한게 발치 부위는 좀 아프긴 하지만 하나도 안부었오요!!아직 하루이틀 밖에 안됬지만 병원에 신뢰가 갑니다! 추천이요!!!",5,1,,,2018.11.23,ikou****,라이크치과,라이크치과의원,,false,"매복사랑니 발치 하고 왔는데 위생을 꼼꼼히 신경써주시고, 무엇보다 사후관리에 힘써주시는게 느껴졌어요 신기한게 발치 부위는 좀 아프긴 하지만 하나도 안부었오요!!아직 하루이틀 밖에 안됬지만 병원에 신뢰가 갑니다! 추천이요!!!",,
