bookingBusinessId,reviewId,reviewBody,score,isImp,replyBody,resourceUrlList,completedDate,id,bookingItemName,bookingBusinessName,optionNameList,body/0/isHighlight,body/0/text,replyRegDate
44367,1485581,급하게 예약했는데도 친절하게 응대해주시고 치료도 만족스러웠습니다   향후 치아관리에 대해 상세히 설명해주신 점도 좋았어요,5,1,치료가 만족스러우셔서 다행입니다. 소중한 후기 감사드립니다. 정기검진때 뵐게요~,,2017.12.27,wjdt****,44367 연세고운미소치과 삼성점 default 상품,삼성연세고운미소치과의원,,false,급하게 예약했는데도 친절하게 응대해주시고 치료도 만족스러웠습니다   향후 치아관리에 대해 상세히 설명해주신 점도 좋았어요,2018.01.11 17:42:21
44367,1242886,교정상담 받고 왔는데 직원분들 모두 친절하셨어요.,5,1,,,2017.10.31,sjy9****,44367 연세고운미소치과 삼성점 default 상품,삼성연세고운미소치과의원,,false,교정상담 받고 왔는데 직원분들 모두 친절하셨어요.,
44367,1239843,부평에 있는 연세 고운미소치과에서 교정 마치고 이번에 삼성 고운미소치과에서 진료 받았는데 유지장치 떨어진것도 잘 붙여주시고 친절하고 좋았습니다~ 예약시간도 맞춰가니 대기 길지 않아 좋았어요. 다음에 또 방문할게요~!,5,1,안녕하세요~ 부평점에 이어 저희와도 좋은 인연이 되길 바랍니다. 불편한곳 있으시면 연락주시구요 소중한 후기 감사합니다.,,2017.10.30,vabe****,44367 연세고운미소치과 삼성점 default 상품,삼성연세고운미소치과의원,,false,부평에 있는 연세 고운미소치과에서 교정 마치고 이번에 삼성 고운미소치과에서 진료 받았는데 유지장치 떨어진것도 잘 붙여주시고 친절하고 좋았습니다~ 예약시간도 맞춰가니 대기 길지 않아 좋았어요. 다음에 또 방문할게요~!,2017.10.31 12:03:57
44367,1109373,현시점에서 필요하다고 생각되는 치료와 상황에 맞는 방법을 제시해줘서 믿고 가게될 것 같습니다,5,1,안녕하세요 방문해주셔서 감사합니다 아프실수 있는 치료였는데 잘 참아주셔서 감사합니다 항상노력하는 고운미소가 되겠습니다 소중한후기 감사합니다,,2017.09.25,real****,44367 연세고운미소치과 삼성점 default 상품,삼성연세고운미소치과의원,,false,현시점에서 필요하다고 생각되는 치료와 상황에 맞는 방법을 제시해줘서 믿고 가게될 것 같습니다,2017.09.26 09:52:33
44367,1046822,항상 친절하고 과잉진료 안해서 너무 좋아요 장비도 좋고요!!,5,1,안녕하세요^^ 저희 치과를 방문해주셔서 감사합니다 소개해주신 분의 치료도 거의 마무리 되어가네요 항상 편안하고 즐거운 치료가 되도록 노력하겠습니다 소중한 후기 감사합니다~,,2017.08.19,0167****,44367 연세고운미소치과 삼성점 default 상품,삼성연세고운미소치과의원,,false,항상 친절하고 과잉진료 안해서 너무 좋아요 장비도 좋고요!!,2017.09.08 10:50:13
44367,785044,"의사쌤도친절
간호사쌤들은더친절^^",5,1,안녕하세요 ^^ 너무 예쁜 아기와 사모님 모두 방문 감사드립니다 항상 최선을 다하는 고운미소가 되겠습니다,,2017.07.03,high****,44367 연세고운미소치과 삼성점 default 상품,삼성연세고운미소치과의원,,false,"의사쌤도친절
간호사쌤들은더친절^^",2017.07.04 14:41:36
44367,765768,친철한 직원들과 의사선생님 ..상담잘해주셔서 재방문의사가 생기네요 ~~예약해도 대기시간이 조금 생기는거 외엔 좋아요,4,1,안녕하세요 ^^ 기다리게 해드려서 죄송합니다. 당일예약의 경우 먼저 예약하신 분들로 인해 대기 시간이 발생할 수 있는데 미리 안내를 드리지 못한거 같아요..ㅜㅜ 소중한 후기 너무 감사드려요~,,2017.06.26,kill****,44367 연세고운미소치과 삼성점 default 상품,삼성연세고운미소치과의원,,false,친철한 직원들과 의사선생님 ..상담잘해주셔서 재방문의사가 생기네요 ~~예약해도 대기시간이 조금 생기는거 외엔 좋아요,2017.06.27 10:06:05
44367,728801,"당일에 급하게 네이버로 예약했는데 연락을 바로 해줘서 좋았습니다.
직원분들과 의사선생님 모두 친절하고 꼼꼼하게 잘봐주시는 것 같아서 다음에도 재방문할 예정입니다.",4,1,소중한 후기 너무 감사드립니다 앞으로도 저희와의 만남이 즐겁고 편안하실수 있게 최선을다하겠습니다 감사합니다,,2017.06.13,pink****,44367 연세고운미소치과 삼성점 default 상품,삼성연세고운미소치과의원,,false,"당일에 급하게 네이버로 예약했는데 연락을 바로 해줘서 좋았습니다.
직원분들과 의사선생님 모두 친절하고 꼼꼼하게 잘봐주시는 것 같아서 다음에도 재방문할 예정입니다.",2017.06.15 22:49:42
44367,691657,"항상친절하게 치료해주셔서 , 무서운 치과치료도 무사히받고왔네요, 치실도 서비스로주셨는데 감사합니다:)!",5,1,저희가 도움이되어서 정말 기분이 좋네요^^ 항상 노력하는 고운미소가 되겠습니다 소중한 후기 정말감사합니다~,,2017.05.30,ppoy****,44367 연세고운미소치과 삼성점 default 상품,삼성연세고운미소치과의원,,false,"항상친절하게 치료해주셔서 , 무서운 치과치료도 무사히받고왔네요, 치실도 서비스로주셨는데 감사합니다:)!",2017.05.31 09:53:28
44367,406638,예약을 했음에도 20분 기다렸습니다 그거말곤 괞찮앗어요,4,1,"안녕하세요 ^^ 당일 예상하지
못한 상황으로 소중한 시간을 대기하는데 쓰게해드렸네요 정말죄송합니다 다음 내원때는 좀 더 나은 서비스로 함께 할 수 있도록 노력하겠습니다 소중한 후기 감사합니다",,2017.02.14,ftst****,44367 연세고운미소치과 삼성점 default 상품,삼성연세고운미소치과의원,,false,예약을 했음에도 20분 기다렸습니다 그거말곤 괞찮앗어요,2017.02.15 10:32:43
44367,228696,"연탄봉사하시느라 전화가 안되어 네이버로 예약하게되었네요 ㅎㅎ
네이버로 이렇게 예약할수있는 방법 처음 알게되었는데 편리하고 좋은것 같아요.
확인되면 바로 전화주시고~ 친절한 응대 감사합니다^^",5,1,안녕하세요~ 박인애님^^ 치료 받으신곳은 불편하진 않으신가요? 저희도 바로 뭔가 도와드릴 수 있어서 다행이었어요..^^ 정기검진에 또 뵐게요~~!!,,2016.10.29,dewy****,44367 연세고운미소치과 삼성점 default 상품,삼성연세고운미소치과의원,,false,"연탄봉사하시느라 전화가 안되어 네이버로 예약하게되었네요 ㅎㅎ
네이버로 이렇게 예약할수있는 방법 처음 알게되었는데 편리하고 좋은것 같아요.
확인되면 바로 전화주시고~ 친절한 응대 감사합니다^^",2016.11.29 12:49:39
