bookingBusinessId,reviewId,reviewBody,score,isImp,replyBody,resourceUrlList/0,completedDate,id,bookingItemName,bookingBusinessName,optionNameList,body/0/isHighlight,body/0/text,
145939,5209039,"스케일링 받는데 생각보다 아프지 않아서 좋았습니다.
아픈데 꼭 필요한데만 쑤셔서 덜아픈?

회사근처 연x치과에서 했을때는 아프고 붓고 24시간 식사하면 안된다는데, 막상 거울보면 덧니 안쪽에는 치석이 깨끗하게 없어지지않고 좀 남았었거든요. 근데 그건 안된다고 그냥 내보내더군요..ㅡㅡ;;

여긴 스케일링 잘하는데로 검색해서 왔는데, 별다른 말 없어도 깔끔하게 해주시네요. 입헹군 물에 한줄기 핏기만 있을정도로 아주 약간만 나고요. 그때남은 치석까지 통증은 덜한데 구석구석 찔러서 깨끗해지는 느낌이 좋았네요.

와서보니깐 치위생사님들이 여러분 계시는것 같아요. 대기인원이 6명이었는데 10~15분 기다리니 제차례오네요",5,1,,,2019.05.25,mee8****,서울바움치과 예약하기,서울바움치과의원,,false,"스케일링 받는데 생각보다 아프지 않아서 좋았습니다.
아픈데 꼭 필요한데만 쑤셔서 덜아픈?

회사근처 연x치과에서 했을때는 아프고 붓고 24시간 식사하면 안된다는데, 막상 거울보면 덧니 안쪽에는 치석이 깨끗하게 없어지지않고 좀 남았었거든요. 근데 그건 안된다고 그냥 내보내더군요..ㅡㅡ;;

여긴 스케일링 잘하는데로 검색해서 왔는데, 별다른 말 없어도 깔끔하게 해주시네요. 입헹군 물에 한줄기 핏기만 있을정도로 아주 약간만 나고요. 그때남은 치석까지 통증은 덜한데 구석구석 찔러서 깨끗해지는 느낌이 좋았네요.

와서보니깐 치위생사님들이 여러분 계시는것 같아요. 대기인원이 6명이었는데 10~15분 기다리니 제차례오네요",
145939,5190191,스케일링 받고왔는데 꼼꼼하고 안아프게 잘해주셔서 너무좋았어요!,5,1,,,2019.05.25,yous****,서울바움치과 예약하기,서울바움치과의원,,false,스케일링 받고왔는데 꼼꼼하고 안아프게 잘해주셔서 너무좋았어요!,
145939,5091679,"진료 보실 때 어떻게 어떻게 하신다 차근차근 설명도 해주시고 꼼꼼하신 것 같습니다.
전날 과음으로 몸 상태도 안 좋았는데...편하게 진료해주셔서 좋았습니다.",5,1,,,2019.05.15,cand****,서울바움치과 예약하기,서울바움치과의원,,false,"진료 보실 때 어떻게 어떻게 하신다 차근차근 설명도 해주시고 꼼꼼하신 것 같습니다.
전날 과음으로 몸 상태도 안 좋았는데...편하게 진료해주셔서 좋았습니다.",
145939,5065212,잇몸이 아파서 검색해서 방문했는데 친절하시고 아프지 않게 치료해 주셔서 감사드립니다. :) 인테리어도 편안하고 음악도 좋네요. ????,5,1,,,2019.05.14,lafl****,서울바움치과 예약하기,서울바움치과의원,,false,잇몸이 아파서 검색해서 방문했는데 친절하시고 아프지 않게 치료해 주셔서 감사드립니다. :) 인테리어도 편안하고 음악도 좋네요. ????,
145939,5063411,진짜..친절하고 스케일링 엄청 꼼꼼이 해주십니다,5,1,,,2019.05.13,mica****,서울바움치과 예약하기,서울바움치과의원,,false,진짜..친절하고 스케일링 엄청 꼼꼼이 해주십니다,
145939,5065204,쾌적하고 사람이 붐비지 않아 좋았습니다. 의사선생님과 스탭들 모두 친절했습니다.,5,1,,,2019.05.13,ceci****,서울바움치과 예약하기,서울바움치과의원,,false,쾌적하고 사람이 붐비지 않아 좋았습니다. 의사선생님과 스탭들 모두 친절했습니다.,
145939,5015985,"친절하게 설명해주시고, 
위치나, 서비스에 비해서 가격도 굉장히 합리적인 것 같아요.
직장 가까이 있어 더 좋은 것 같습니다 :) 
애정하는 치과가 될 것 같습니다^^",5,1,,,2019.05.09,sell****,서울바움치과 예약하기,서울바움치과의원,,false,"친절하게 설명해주시고, 
위치나, 서비스에 비해서 가격도 굉장히 합리적인 것 같아요.
직장 가까이 있어 더 좋은 것 같습니다 :) 
애정하는 치과가 될 것 같습니다^^",
145939,4998853,잘봐주십니다. 검진때문에도 꾸준히 방문하려구요.,5,1,,,2019.05.08,sej1****,서울바움치과 예약하기,서울바움치과의원,,false,잘봐주십니다. 검진때문에도 꾸준히 방문하려구요.,
145939,4989237,"크라운 했던 치아가 속으로 썪었을듯해서 임플란트를 각오하고 갔었거든요~
근데, 사진촬영하니 잇몸이 문제였던거라고
임플란트 할 필요없다시더라구요~
역시 과잉진료 절대 안하시는 양심치과 맞더군요~!
의사선생님 뿐만 아니라 간호사선생님들 모두모두 친절하시고 상세한 설명?
아주 만족합니다~
강추입니다~~^^",5,1,,,2019.05.07,sumi****,서울바움치과 예약하기,서울바움치과의원,,false,"크라운 했던 치아가 속으로 썪었을듯해서 임플란트를 각오하고 갔었거든요~
근데, 사진촬영하니 잇몸이 문제였던거라고
임플란트 할 필요없다시더라구요~
역시 과잉진료 절대 안하시는 양심치과 맞더군요~!
의사선생님 뿐만 아니라 간호사선생님들 모두모두 친절하시고 상세한 설명?
아주 만족합니다~
강추입니다~~^^",
145939,4911158,다른병원에서 사랑니4개빼라그래서 혹시나하고 여기왓는데 체크다시해주시고 안심하고치료받앗어요 맘에들어욤 회사근처라더좋고 다들친절하세욤,5,1,,,2019.05.02,happ****,서울바움치과 예약하기,서울바움치과의원,,false,다른병원에서 사랑니4개빼라그래서 혹시나하고 여기왓는데 체크다시해주시고 안심하고치료받앗어요 맘에들어욤 회사근처라더좋고 다들친절하세욤,
145939,6246848,"친절하고 좋아요 
직장인시간 맞춰서 가기 너무 좋고 내부도 깨끗합니다",5,1,,,2019.08.08,appl****,서울바움치과 예약하기,서울바움치과의원,,false,"친절하고 좋아요 
직장인시간 맞춰서 가기 너무 좋고 내부도 깨끗합니다",
145939,6232721,원장님 및 간호사님들의 친철하고 자세한 설명과 서비스에 깊은 인상 받았습니다. 인생 치과 찾은 듯,5,1,,,2019.08.07,ozy1****,서울바움치과 예약하기,서울바움치과의원,,false,원장님 및 간호사님들의 친철하고 자세한 설명과 서비스에 깊은 인상 받았습니다. 인생 치과 찾은 듯,
145939,6119957,"사랑니 발치때문에 방문했는데 어떤 과정을 거쳐야하는지, 추후에 어떤 식으로 양치를 하면 좋은지에 대해서 구체적으로 설명주셔서 너무 좋았습니다! 또 올게요!!",5,1,,,2019.08.02,mins****,서울바움치과 예약하기,서울바움치과의원,,false,"사랑니 발치때문에 방문했는데 어떤 과정을 거쳐야하는지, 추후에 어떤 식으로 양치를 하면 좋은지에 대해서 구체적으로 설명주셔서 너무 좋았습니다! 또 올게요!!",
145939,5952999,"검사도 꼼꼼히 해주시고 친절해요
과잉진료는 안하시는것같아요
오늘부터 치료받을예정인데 안아팠으면좋겠어요",5,1,,,2019.07.22,blue****,서울바움치과 예약하기,서울바움치과의원,,false,"검사도 꼼꼼히 해주시고 친절해요
과잉진료는 안하시는것같아요
오늘부터 치료받을예정인데 안아팠으면좋겠어요",
145939,5765072,"깔끔하고 깨끗했어요
스케일링도 빠르게 잘 해주시더라구요^-^",5,1,,,2019.07.08,pyoo****,서울바움치과 예약하기,서울바움치과의원,,false,"깔끔하고 깨끗했어요
스케일링도 빠르게 잘 해주시더라구요^-^",
145939,5794081,병원분들 모두 친절하시구 치료과정도 상세하게 알려주셔서 안심하고 치료받았습니다~^^,5,1,,,2019.07.04,dnal****,서울바움치과 예약하기,서울바움치과의원,,false,병원분들 모두 친절하시구 치료과정도 상세하게 알려주셔서 안심하고 치료받았습니다~^^,
145939,5692657,친절하고 쾌적합니다~,4,1,,,2019.07.03,wjdd****,서울바움치과 예약하기,서울바움치과의원,,false,친절하고 쾌적합니다~,
145939,5670715,야간진료 대기가 길었지만 친절한설명에 감사했고 과잉진료가 느껴지지 않아 좋았습니다.,4,1,,,2019.07.01,craz****,서울바움치과 예약하기,서울바움치과의원,,false,야간진료 대기가 길었지만 친절한설명에 감사했고 과잉진료가 느껴지지 않아 좋았습니다.,
145939,5537822,친절하고 좋았습니다,4,1,,,2019.06.21,jjgg****,서울바움치과 예약하기,서울바움치과의원,,false,친절하고 좋았습니다,
145939,5406291,"일단은 모든 분들이 엄청 친절하셨구요, 원장님께서 사진을 보여주시며 아주 하나하나 디테일하게 설명을 하셨으며 강박적으로 무엇을 해야 된다 이런건 하나도 없었습니다. 모두 손님이 선택하되 다만 어떻게 하면 좋겠다는 건의는 정말 잘 해주셨어요. 내일 사랑니 발치 하기로 했는데 뭔가 마음이 놓이네요. 내일도 잘 부탁 드립니다.",5,1,,,2019.06.10,yban****,서울바움치과 예약하기,서울바움치과의원,,false,"일단은 모든 분들이 엄청 친절하셨구요, 원장님께서 사진을 보여주시며 아주 하나하나 디테일하게 설명을 하셨으며 강박적으로 무엇을 해야 된다 이런건 하나도 없었습니다. 모두 손님이 선택하되 다만 어떻게 하면 좋겠다는 건의는 정말 잘 해주셨어요. 내일 사랑니 발치 하기로 했는데 뭔가 마음이 놓이네요. 내일도 잘 부탁 드립니다.",
