bookingBusinessId,reviewId,reviewBody,score,isImp,replyBody,resourceUrlList,completedDate,id,bookingItemName,bookingBusinessName,optionNameList,body/0/isHighlight,body/0/text,replyRegDate
214189,4274789,"충치치료받고왔어요
막 다 권유안하시고 지켜볼껀 지켜보자고하시고
과잉진료안하시는거같아요 ~!

설명잘해주시고 친절하시고
무엇보다 대기실이 북까페처럼되있어요
책도많아서 대기시간이 지루하지않았어요~!ㅎㅎ",5,1,"안녕하세요 김 OO 님 

좋은말씀 남겨주셔서 감사합니다 
다음 정기검진때 또 뵐게요 ~!  :)",,2019.02.22,khyu****,이디치과 진료예약,이디치과의원,,false,"충치치료받고왔어요
막 다 권유안하시고 지켜볼껀 지켜보자고하시고
과잉진료안하시는거같아요 ~!

설명잘해주시고 친절하시고
무엇보다 대기실이 북까페처럼되있어요
책도많아서 대기시간이 지루하지않았어요~!ㅎㅎ",2019.02.25 11:43:10
214189,4249467,"의사 선생님이 친절하시고 설명도 잘해주셔서 스케일링이랑 임플란트 치료 다 받았습니다. 
다른 간호사 샘들도 밝고 친절하시더라구요.
항상 치과갈땐 긴장하게 되는데 이디치과에서는 불편감 없이 편하게 치료 받고 왔네요.^^
치과도 깔끔하고 치료도 안아프게 잘해주셔서 다음에 또 방문하려고 합니다!",5,1,"안녕하세요 백OO님 : )

오랜만에 치료받으셔서 힘드셨을텐데 편안하셨다니 다행이에요 :)

앞으로 임플란트때문에 자주 뵙게될텐데
그때마다 더 꼼꼼하고 친절하게 봐드릴게요 !

다음진료때 뵙겠습니다 :)",,2019.02.22,arim****,이디치과 진료예약,이디치과의원,,false,"의사 선생님이 친절하시고 설명도 잘해주셔서 스케일링이랑 임플란트 치료 다 받았습니다. 
다른 간호사 샘들도 밝고 친절하시더라구요.
항상 치과갈땐 긴장하게 되는데 이디치과에서는 불편감 없이 편하게 치료 받고 왔네요.^^
치과도 깔끔하고 치료도 안아프게 잘해주셔서 다음에 또 방문하려고 합니다!",2019.02.25 11:39:33
