bookingBusinessId,reviewId,reviewBody,score,isImp,replyBody,replyRegDate,resourceUrlList/0,completedDate,id,bookingItemName,bookingBusinessName,optionNameList,body/0/isHighlight,body/0/text
132791,2232851,급하게 진료받길 원해서 근거리로 알아보고 방문했어요 ㅎㅎ! 당일예약이었는데도 대기시간없이 바로 진료 받을수있게 해주셔서 너무 좋았어요~~. 정해놓고 다닌 치과는 없었는데 직원분들도 너무 친절하고 건물도 깨끗해서 앞으로 일레븐으로 계속 올것같아요! 원장님이 과잉진료하시지 않고 딱 필요한부분만 말씀해주신것도 맘에 들어요!ㅋㅋ 신뢰가 갑니당~!!!,5,1,안녕하세요? 일레븐치과입니다 ^^ 저희 일레븐치과는 과잉진료 없는 진료를 하고자 의료진 모두가 노력하고 있습니다. 이렇게 칭찬해 주시니 몸둘바를 모르겠네요 :) 앞으로도 기대해 부응할수 있도록 더욱더 열심히 진료할께요. 감사합니다~,2018.05.11 10:32:29,,2018.05.10,zndn****,일레븐치과 진료예약,일레븐치과의원,,false,급하게 진료받길 원해서 근거리로 알아보고 방문했어요 ㅎㅎ! 당일예약이었는데도 대기시간없이 바로 진료 받을수있게 해주셔서 너무 좋았어요~~. 정해놓고 다닌 치과는 없었는데 직원분들도 너무 친절하고 건물도 깨끗해서 앞으로 일레븐으로 계속 올것같아요! 원장님이 과잉진료하시지 않고 딱 필요한부분만 말씀해주신것도 맘에 들어요!ㅋㅋ 신뢰가 갑니당~!!!
132791,2228319,"리뷰 보고 간건데
뭐가 좋다는건지 잘 모르겟어요
요새 그정도 안하는 병원 있나싶고 충치치료 가격이 터무니 없이 비싸고 보험이 되는 것이 분명히 있을텐데 취급을 안하더라구요 저는 치아가 건강 한 편이라 충치치료를 한적이 없어서 이리 이야기 하는지 모르지만요 
인사성을 봐도 알 수 있는데 손님 들한테 억지로 웃음 직는 모습
택배 기사님한테는 인사 한마디 안하는 그럼 인성으로 손님들 한테  진정성 있는 친절함인지 묻고 싶습니다",1,1,안녕하세요? 일레븐치과입니다. 일단 저희 서비스에 만족을 느끼지 못하게 해드린점 정말 죄송스럽게 생각합니다. 저희 병원은 아말감은 취급하지 않지만 GI라는 보험으로 떼우는 재료는 취급하여 진료하고 있습니다. 고객님의 치아는 진단결과 인레이 치료 및 레진으로 떼우는 치료가 필요하다고 판단이 되었기 때문에 그렇게 설명을 드린것이며 터무니 없이 비싼 치료를 권한것은 절대 아닙니다. 그리고 손님들한테 억지로 웃음짓는 모습 및 택배기사님 관련 말씀은 솔직히 납득하지는 못하겠습니다. 앞으로 더욱더 노력하라는 말씀으로 알고 더 좋은 의료 서비스를 할수 있도록 더욱더 노력 하겠습니다. 감사합니다 ^^,2018.05.10 16:04:03,,2018.05.09,pirr****,일레븐치과 진료예약,일레븐치과의원,,false,"리뷰 보고 간건데
뭐가 좋다는건지 잘 모르겟어요
요새 그정도 안하는 병원 있나싶고 충치치료 가격이 터무니 없이 비싸고 보험이 되는 것이 분명히 있을텐데 취급을 안하더라구요 저는 치아가 건강 한 편이라 충치치료를 한적이 없어서 이리 이야기 하는지 모르지만요 
인사성을 봐도 알 수 있는데 손님 들한테 억지로 웃음 직는 모습
택배 기사님한테는 인사 한마디 안하는 그럼 인성으로 손님들 한테  진정성 있는 친절함인지 묻고 싶습니다"
132791,1878609,"집근처라 검색하고가서 스케일링했어요^^
아프지않게해달라고 했더니 가글마취해주셨고
선생님께서 웃으시면서 친절하게 해주셔서
기분좋게하고왔어요
원장님 안계셔서 충치치료는 못하구..
다음번에 갈게요^^",5,1,"좋게 봐주셔서 감사합니다. 앞으로도 편안하게
진료 받을수 있도록 더욱더 노력하겠습니다^^",2018.03.03 11:20:40,,2018.03.02,002h****,일레븐치과 진료예약,일레븐치과의원,,false,"집근처라 검색하고가서 스케일링했어요^^
아프지않게해달라고 했더니 가글마취해주셨고
선생님께서 웃으시면서 친절하게 해주셔서
기분좋게하고왔어요
원장님 안계셔서 충치치료는 못하구..
다음번에 갈게요^^"
132791,1833715,"어머니 치아가 아파서 다른치과들에서 진료를 받았는데 무조건 임플란트를 하라고 했어요.
그래서 믿을만한 곳에서 마지막으로 확인받고 싶어하셔서 여기 일레븐으로 저와 함께가서 진료 했죠. 선생님은 아직은 좀더 살려서 써봐도 좋을것 같다고 하시며 간단한 치료를 해주셨구요. 신기하게도 어머니가 통증이 없으시다고 하네요. 제가 다니던 치과지만 역시 과잉진료가 없네요!!. 감사합니다~",5,1,"어머니가 누구신지 기억합니다^^ 치아의 통증이 사라지셨다니 참 다행이구요. 저희 일레븐치과에서 가장 중요하게 생각하는 것은 ""과잉진료를 하지말자"" 입니다. 앞으로도 정확한 진료를 진행해 드리고자 더욱더 노력하겠습니다.",2018.02.25 07:40:45,,2018.02.23,gapp****,일레븐치과 진료예약,일레븐치과의원,,false,"어머니 치아가 아파서 다른치과들에서 진료를 받았는데 무조건 임플란트를 하라고 했어요.
그래서 믿을만한 곳에서 마지막으로 확인받고 싶어하셔서 여기 일레븐으로 저와 함께가서 진료 했죠. 선생님은 아직은 좀더 살려서 써봐도 좋을것 같다고 하시며 간단한 치료를 해주셨구요. 신기하게도 어머니가 통증이 없으시다고 하네요. 제가 다니던 치과지만 역시 과잉진료가 없네요!!. 감사합니다~"
132791,1806574,"예약이 편리해서 좋았습니다. 주차는 발렛비 1000원을 내고 발렛을 맡겨야하는데, 차 찾을 때 매번 대기시간이 너무 길어서 불편합니다.",4,1,안녕하세요? 일레븐치과입니다. 주차에 불편을 드려 대단히 죄송합니다. 더욱더 빠르고 편리한 주차 환경을 마련할수 있도록 노력하겠습니다^^,2018.02.20 12:15:40,,2018.02.19,cpt1****,일레븐치과 진료예약,일레븐치과의원,,false,"예약이 편리해서 좋았습니다. 주차는 발렛비 1000원을 내고 발렛을 맡겨야하는데, 차 찾을 때 매번 대기시간이 너무 길어서 불편합니다."
132791,1694657,"갑자기 이가 너무 아파서 회사근처 치과 검색해서 일레븐치과 가게됬어요
이전에 다른치과 진료볼때는 예약 다시 잡고 치료 여러번 해야한다고해서 미루고 있었거든요 
역시나 원장님이 보시고 치료할게 많다고 ㅠㅠ 
그래도 당일에 치료 다 받을수있어서 너무 좋았네요
치료받을때 하나도 안아팠고요 
원장님 실력도 확실히 좋아요 
병원 실내도 너무 고급스럽고 
직원들도 다 친절해요 ~
알고보니 교정도 전문으로 하는 병원이라더라고요
다음번에 상담받으로갈게요 ㅎㅎ^^",5,1,고객님 감사합니다^^ 만족을 드렸다니 너무 기뻐요~ 앞으로도 치아가 불편하시면 저희 일레븐치과를 기억해주세요 :),2018.02.01 12:12:39,,2018.01.31,mode****,일레븐치과 진료예약,일레븐치과의원,,false,"갑자기 이가 너무 아파서 회사근처 치과 검색해서 일레븐치과 가게됬어요
이전에 다른치과 진료볼때는 예약 다시 잡고 치료 여러번 해야한다고해서 미루고 있었거든요 
역시나 원장님이 보시고 치료할게 많다고 ㅠㅠ 
그래도 당일에 치료 다 받을수있어서 너무 좋았네요
치료받을때 하나도 안아팠고요 
원장님 실력도 확실히 좋아요 
병원 실내도 너무 고급스럽고 
직원들도 다 친절해요 ~
알고보니 교정도 전문으로 하는 병원이라더라고요
다음번에 상담받으로갈게요 ㅎㅎ^^"
132791,1688715,"병원에 도착하자마자 바로 검사하고 
사진찍고 
다른치과는 예약하고 가도 한참을 기다려야하는데 
여긴 바로바로 진료볼 수 있어서 좋았어요 
야간진료도 너무 좋아요",5,1,고객님 감사합니다. 앞으로도 고객님들이 만족하실수 있도록 더욱더 노력하겠습니다^^,2018.01.31 11:35:27,,2018.01.30,blue****,일레븐치과 진료예약,일레븐치과의원,,false,"병원에 도착하자마자 바로 검사하고 
사진찍고 
다른치과는 예약하고 가도 한참을 기다려야하는데 
여긴 바로바로 진료볼 수 있어서 좋았어요 
야간진료도 너무 좋아요"
132791,1689212,"당일진료와 당일치료가 가능할지 긴가민가 하고 방문했는데 정말 당일치료로 끝내주셨습니다. 세렉인가 그 장비가 있어서 가능하다고 하던데 보통 다른 치과는 2,3번 방문해야 되는데 진짜 놀라웠습니다. 제 직장 근처에 이런치과가 있어서 너무 좋습니다. 추천 드려요!",5,1,감사합니다. 저희 일레븐치과는 고속밀링장비 세렉을 보유하여 원데이치료가 가능한 병원이에요. 바쁘신 분들 치과 치료로 고민하지 마시고 언제든지 방문해 주세요^^,2018.01.31 11:49:28,,2018.01.16,gapp****,일레븐치과 진료예약,일레븐치과의원,,false,"당일진료와 당일치료가 가능할지 긴가민가 하고 방문했는데 정말 당일치료로 끝내주셨습니다. 세렉인가 그 장비가 있어서 가능하다고 하던데 보통 다른 치과는 2,3번 방문해야 되는데 진짜 놀라웠습니다. 제 직장 근처에 이런치과가 있어서 너무 좋습니다. 추천 드려요!"
